Time,Cell_Type,Cell_ID,Cell_RSSI,WiFi_MAC,WiFi_ID,WiFi_RSSI
signal_20260108_1624.csv,"['Lte', 'Lte', 'Lte', 'Lte', 'Lte']","[309, 317, 120, 133, 358]","[-98, -94, -129, -128, -130]","[7c:25:da:f2:d6:64, 6c:59:76:2b:cd:0f, b0:cc:ce:2a:1d:dd, 48:8f:4c:9d:57:66, 5c:a0:01:75:b9:5e, 58:56:c2:5c:00:26, 58:56:c2:5c:00:21, 58:c4:1e:71:1a:c8, 58:56:c2:5c:00:20, 58:56:c2:5c:00:25, 58:56:c2:5c:00:23, 58:56:c2:5c:00:24, 58:56:c2:5c:00:27, 02:ee:ea:d7:06:42, 58:56:c2:5c:00:22]","[CAR-DVR-d664, SVWSBCD0F, , BYD_DVR_9D5766, MIFI-B95E, WirelessLocal, WirelessMobile, , WirelessSGF, WirelessDS, IKEA WIFI, WirelessLocal_IO, IKEA APP, Xiaomi SU7_631827, WirelessICC]","[-63, -81, -84, -86, -87, -88, -88, -89, -89, -89, -89, -89, -89, -90, -90]"
signal_20260108_1624.csv,"['Lte', 'Lte', 'Lte', 'Lte', 'Lte']","[309, 317, 120, 133, 358]","[-96, -98, -129, -128, -130]","[7c:25:da:f2:d6:64, 6c:59:76:2b:cd:0f, 5c:a0:01:75:b9:5e, b0:cc:ce:2a:1d:dd, 58:56:c2:5b:f5:05, 48:8f:4c:9d:57:66, 02:ee:ea:d7:06:42, 58:56:c2:5c:00:26, 58:56:c2:5b:f5:00, 58:56:c2:5b:f5:01, 58:56:c2:5b:f5:03, 58:56:c2:5c:00:25, 58:56:c2:5c:00:23, 58:56:c2:5c:00:21, 58:56:c2:5c:00:24, 58:56:c2:5c:00:22, 58:56:c2:5b:f5:07, 58:56:c2:5b:f5:02, 58:56:c2:5c:00:34, 58:56:c2:5c:00:35, 58:56:c2:5b:f5:04, 58:56:c2:5c:00:27, 58:56:c2:5b:f5:06, 58:56:c2:5c:00:20]","[CAR-DVR-d664, SVWSBCD0F, MIFI-B95E, , WirelessDS, BYD_DVR_9D5766, Xiaomi SU7_631827, WirelessLocal, WirelessSGF, WirelessMobile, IKEA WIFI, WirelessDS, IKEA WIFI, WirelessMobile, WirelessLocal_IO, WirelessICC, IKEA APP, WirelessICC, WirelessLocal_IO, WirelessDS, WirelessLocal_IO, IKEA APP, WirelessLocal, WirelessSGF]","[-55, -71, -81, -82, -84, -85, -88, -88, -89, -89, -89, -90, -90, -90, -90, -90, -90, -90, -90, -90, -91, -92, -92, -93]"
signal_20260108_1624.csv,"['Lte', 'Lte', 'Lte', 'Lte', 'Lte']","[309, 317, 133, 120, 358]","[-96, -97, -127, -128, -127]","[7c:25:da:f2:d6:64, 6c:59:76:2b:cd:0f, 48:8f:4c:9d:57:66, 5c:a0:01:75:b9:5e, f0:a8:82:ef:8a:71, 58:c4:1e:71:1a:c8, 58:56:c2:5b:f5:07]","[CAR-DVR-d664, SVWSBCD0F, BYD_DVR_9D5766, MIFI-B95E, PPG_N291plus_EF8A71, , IKEA APP]","[-58, -64, -80, -82, -90, -91, -91]"
signal_20260108_1624.csv,"['Lte', 'Lte', 'Lte', 'Lte', 'Lte']","[309, 317, 133, 120, 358]","[-100, -97, -127, -128, -127]","[7c:25:da:f2:d6:64, 6c:59:76:2b:cd:0f, 58:56:c2:5b:f5:02, 58:56:c2:5b:f5:03, 58:56:c2:5b:f5:00, 58:56:c2:5b:f5:01, 58:56:c2:5b:f5:06, 58:56:c2:5b:f5:07, 58:56:c2:5b:f5:05, 58:56:c2:5b:f5:04, 48:8f:4c:9d:57:66, f0:a8:82:ef:8a:71, 58:56:c2:5c:00:21, 58:56:c2:5c:00:20, 58:56:c2:5c:00:26, 58:56:c2:5c:00:23, 58:56:c2:5c:00:22, 58:56:c2:5c:00:25]","[CAR-DVR-d664, SVWSBCD0F, WirelessICC, IKEA WIFI, WirelessSGF, WirelessMobile, WirelessLocal, IKEA APP, WirelessDS, WirelessLocal_IO, BYD_DVR_9D5766, PPG_N291plus_EF8A71, WirelessMobile, WirelessSGF, WirelessLocal, IKEA WIFI, WirelessICC, WirelessDS]","[-64, -69, -81, -82, -83, -83, -83, -83, -83, -84, -87, -87, -90, -91, -91, -91, -91, -92]"
signal_20260108_1624.csv,"['Lte', 'Lte', 'Lte', 'Lte', 'Lte', 'Lte', 'Lte']","[316, 309, 317, 133, 358, 120, 0]","[-94, -101, -96, -129, -129, -129, 0]","[7c:25:da:f2:d6:64, 6c:59:76:2b:cd:0f, 5c:a0:01:75:b9:5e, 58:56:c2:5b:f5:01, 58:56:c2:5b:f5:06, 58:56:c2:5b:f5:05, 58:56:c2:5b:f5:02, 48:8f:4c:9d:57:66, 58:56:c2:5b:f5:03, 58:56:c2:5b:f5:04, 58:56:c2:5b:f5:07, 58:56:c2:5b:f5:00, 58:56:c2:5b:f1:e2, 58:56:c2:5b:f1:e4, 58:56:c2:5b:f1:e1, 58:56:c2:5b:f1:e3, b0:cc:ce:2a:1d:dd, f0:a8:82:ef:8a:71, 58:56:c2:5b:f5:10, 58:56:c2:5b:f1:e0, 58:56:c2:5b:f1:e5, 58:56:c2:5b:f5:12, 58:56:c2:5b:f1:e7, 58:56:c2:5b:f5:11, 58:56:c2:5b:f1:e6]","[CAR-DVR-d664, SVWSBCD0F, MIFI-B95E, WirelessMobile, WirelessLocal, WirelessDS, WirelessICC, BYD_DVR_9D5766, IKEA WIFI, WirelessLocal_IO, IKEA APP, WirelessSGF, WirelessICC, WirelessLocal_IO, WirelessMobile, IKEA WIFI, , PPG_N291plus_EF8A71, WirelessSGF, WirelessSGF, WirelessDS, WirelessICC, IKEA APP, WirelessMobile, WirelessLocal]","[-56, -69, -76, -80, -80, -80, -80, -81, -81, -81, -81, -82, -86, -86, -88, -88, -89, -89, -89, -89, -89, -90, -90, -91, -91]"
signal_20260108_1624.csv,"['Lte', 'Lte', 'Lte', 'Lte', 'Lte']","[316, 317, 309, 0, 358]","[-95, -89, -98, 0, -129]","[7c:25:da:f2:d6:64, 6c:59:76:2b:cd:0f, 5c:a0:01:75:b9:5e, 48:8f:4c:9d:57:66, f0:a8:82:ef:8a:71, b0:cc:ce:2a:1d:dd, 58:c4:1e:71:1a:c8, 58:56:c2:5b:f5:02, ec:41:f9:72:e5:b6, 58:56:c2:5b:f5:01, 58:56:c2:5b:f5:06, 58:56:c2:5b:f5:03, 58:56:c2:5b:f5:07, 58:56:c2:5b:f5:05, 58:56:c2:5b:f1:e1, 58:56:c2:5b:f1:e2, 58:56:c2:5b:f1:e3, 58:56:c2:5b:f5:00, 58:56:c2:5b:f5:04, 58:56:c2:5b:f1:e4, 58:56:c2:5b:f1:e5]","[CAR-DVR-d664, SVWSBCD0F, MIFI-B95E, BYD_DVR_9D5766, PPG_N291plus_EF8A71, , , WirelessICC, HIKVISION-C6LITE-SEHL, WirelessMobile, WirelessLocal, IKEA WIFI, IKEA APP, WirelessDS, WirelessMobile, WirelessICC, IKEA WIFI, WirelessSGF, WirelessLocal_IO, WirelessLocal_IO, WirelessDS]","[-63, -72, -75, -78, -83, -87, -88, -88, -88, -89, -89, -89, -89, -89, -89, -89, -89, -90, -90, -91, -91]"
signal_20260108_1624.csv,"['Lte', 'Lte', 'Lte', 'Lte', 'Lte']","[317, 316, 309, 358, 357]","[-93, -91, -95, -131, -130]","[58:56:c2:5b:f5:07, 7c:25:da:f2:d6:64, 5c:a0:01:75:b9:5e, 6c:59:76:2b:cd:0f, 58:56:c2:5b:f1:e1, 58:56:c2:5b:f1:e2, 58:56:c2:5b:f1:e0, 58:56:c2:5b:f1:e3, 58:56:c2:5b:f1:e4, 58:56:c2:5b:f1:e5, 58:56:c2:5b:f1:e7, 58:56:c2:5b:f1:e6, 58:56:c2:5b:f5:02, 48:8f:4c:9d:57:66, 58:56:c2:5b:f5:01, 58:56:c2:5b:f5:06, 58:56:c2:5b:f5:00, 58:56:c2:5b:f5:03, 58:56:c2:5b:f5:04, 58:56:c2:5b:f5:05, 58:c4:1e:71:1a:c8]","[IKEA APP, CAR-DVR-d664, MIFI-B95E, SVWSBCD0F, WirelessMobile, WirelessICC, WirelessSGF, IKEA WIFI, WirelessLocal_IO, WirelessDS, IKEA APP, WirelessLocal, WirelessICC, BYD_DVR_9D5766, WirelessMobile, WirelessLocal, WirelessSGF, IKEA WIFI, WirelessLocal_IO, WirelessDS, ]","[-70, -72, -73, -75, -77, -77, -78, -78, -78, -78, -78, -79, -85, -86, -87, -87, -88, -88, -89, -89, -91]"
signal_20260108_1624.csv,"['Lte', 'Lte', 'Lte', 'Lte']","[317, 316, 358, 357]","[-92, -91, -131, -130]","[7c:25:da:f2:d6:64, 5c:a0:01:75:b9:5e, f0:a8:82:ef:8a:71, 48:8f:4c:9d:57:66, 6c:59:76:2b:cd:0f, 58:56:c2:5b:f1:e1, 58:56:c2:5b:f1:e4, 58:56:c2:5b:f1:e5, 58:56:c2:5b:f1:e2, 58:56:c2:5b:f1:e3, 58:56:c2:5b:f1:e6, 58:56:c2:5b:f1:e7, 58:56:c2:5b:f1:e0, ec:41:f9:72:e5:b6, 58:56:c2:5b:f1:23]","[CAR-DVR-d664, MIFI-B95E, PPG_N291plus_EF8A71, BYD_DVR_9D5766, SVWSBCD0F, WirelessMobile, WirelessLocal_IO, WirelessDS, WirelessICC, IKEA WIFI, WirelessLocal, IKEA APP, WirelessSGF, HIKVISION-C6LITE-SEHL, IKEA WIFI]","[-65, -69, -76, -77, -83, -83, -83, -83, -84, -84, -84, -84, -85, -87, -94]"
signal_20260108_1624.csv,"['Lte', 'Lte', 'Lte', 'Lte']","[317, 316, 358, 357]","[-92, -91, -131, -130]","[7c:25:da:f2:d6:64, 5c:a0:01:75:b9:5e, 6c:59:76:2b:cd:0f, f0:a8:82:ef:8a:71, 58:56:c2:5b:f1:e0, 72:ae:fd:76:8b:3c, 58:56:c2:5b:f1:e2, 58:56:c2:5b:f1:e7, 58:56:c2:5b:f1:e1, 58:56:c2:5b:f1:e3, 58:56:c2:5b:f1:e4, 58:56:c2:5b:f1:e5, 58:56:c2:5b:f1:e6, ec:41:f9:72:e5:b6]","[CAR-DVR-d664, MIFI-B95E, SVWSBCD0F, PPG_N291plus_EF8A71, WirelessSGF, DIRECT-f7e3-1267, WirelessICC, IKEA APP, WirelessMobile, IKEA WIFI, WirelessLocal_IO, WirelessDS, WirelessLocal, HIKVISION-C6LITE-SEHL]","[-70, -73, -77, -84, -89, -89, -91, -91, -92, -92, -92, -92, -92, -92]"
signal_20260108_1624.csv,"['Lte', 'Lte', 'Lte', 'Lte']","[317, 316, 358, 357]","[-92, -97, -131, -130]","[7c:25:da:f2:d6:64, 5c:a0:01:75:b9:5e, 6c:59:76:2b:cd:0f, 72:ae:fd:76:8b:3c, 58:56:c2:5b:f1:21, 58:56:c2:5b:f1:26, 58:56:c2:5b:f1:27, 58:56:c2:5b:f1:23, 58:56:c2:5b:f1:20, 58:56:c2:5b:f1:24, 58:56:c2:5b:f1:25, f0:a8:82:ef:8a:71, 58:56:c2:5b:f1:22, 68:8f:c1:e2:f0:16]","[CAR-DVR-d664, MIFI-B95E, SVWSBCD0F, DIRECT-f7e3-1267, WirelessMobile, WirelessLocal, IKEA APP, IKEA WIFI, WirelessSGF, WirelessLocal_IO, WirelessDS, PPG_N291plus_EF8A71, WirelessICC, LSA_f016]","[-70, -73, -84, -85, -88, -88, -88, -89, -89, -89, -89, -90, -91, -93]"
signal_20260108_1624.csv,"['Lte', 'Lte', 'Lte', 'Lte']","[317, 316, 357, 358]","[-84, -94, -129, -128]","[7c:25:da:f2:d6:64, 5c:a0:01:75:b9:5e, 48:8f:4c:9d:57:66, 72:ae:fd:76:8b:3c, 58:c4:1e:76:9c:d7, 58:56:c2:5b:f1:27, ec:41:f9:72:e5:b6, f0:a8:82:ef:8a:71, 68:8f:c1:e2:f0:16]","[CAR-DVR-d664, MIFI-B95E, BYD_DVR_9D5766, DIRECT-f7e3-1267, , IKEA APP, HIKVISION-C6LITE-SEHL, PPG_N291plus_EF8A71, LSA_f016]","[-75, -75, -78, -83, -85, -86, -90, -91, -92]"
signal_20260108_1624.csv,"['Lte', 'Lte', 'Lte', 'Lte']","[317, 316, 357, 358]","[-85, -96, -129, -128]","[48:8f:4c:9d:57:66, 7c:25:da:f2:d6:64, 5c:a0:01:75:b9:5e, 58:56:c2:5b:f1:21, 58:56:c2:5b:f1:24, 58:56:c2:5b:f1:e2, 58:56:c2:5b:f1:e3, 58:56:c2:5b:f1:26, 58:56:c2:5b:f1:e4, 58:56:c2:5b:f1:23, 58:56:c2:5b:f1:20, 58:56:c2:5b:f1:22, 58:56:c2:5b:f1:25, ec:41:f9:72:e5:b6, 6c:59:76:2b:cd:0f, 72:ae:fd:76:8b:3c, 22:c3:43:be:99:37, 58:56:c2:5b:f1:e6, 58:56:c2:5b:f1:e7, 58:56:c2:5b:f1:e5, 58:56:c2:5b:ef:06, 58:56:c2:5b:f1:e1, 58:c4:1e:76:9c:d7]","[BYD_DVR_9D5766, CAR-DVR-d664, MIFI-B95E, WirelessMobile, WirelessLocal_IO, WirelessICC, IKEA WIFI, WirelessLocal, WirelessLocal_IO, IKEA WIFI, WirelessSGF, WirelessICC, WirelessDS, HIKVISION-C6LITE-SEHL, SVWSBCD0F, DIRECT-f7e3-1267, Xiaomi SU7_266697, WirelessLocal, IKEA APP, WirelessDS, WirelessLocal, WirelessMobile, ]","[-70, -74, -82, -82, -82, -83, -83, -83, -84, -84, -84, -84, -84, -87, -88, -88, -88, -89, -89, -90, -90, -91, -95]"
signal_20260108_1624.csv,"['Lte', 'Lte', 'Lte', 'Lte']","[317, 316, 357, 358]","[-82, -94, -129, -128]","[7c:25:da:f2:d6:64, 48:8f:4c:9d:57:66, 5c:a0:01:75:b9:5e, 72:ae:fd:76:8b:3c, 58:56:c2:5b:f1:24, 58:56:c2:5b:f1:25, 58:56:c2:5b:f1:26, 58:56:c2:5b:f1:23, 58:56:c2:5b:f1:20, 58:56:c2:5b:f1:21, 58:56:c2:5b:f1:22, 58:56:c2:5b:f1:27, 58:56:c2:5c:01:00, ec:41:f9:72:e5:b6, b8:3a:08:53:69:99, 58:56:c2:5c:01:06, 68:8f:c1:e2:f0:16, 58:56:c2:5c:01:02, 58:56:c2:5c:01:07, 70:3a:73:03:80:81]","[CAR-DVR-d664, BYD_DVR_9D5766, MIFI-B95E, DIRECT-f7e3-1267, WirelessLocal_IO, WirelessDS, WirelessLocal, IKEA WIFI, WirelessSGF, WirelessMobile, WirelessICC, IKEA APP, WirelessSGF, HIKVISION-C6LITE-SEHL, Tenda_536998, WirelessLocal, LSA_f016, WirelessICC, IKEA APP, BOYOL-RF]","[-71, -74, -82, -83, -84, -85, -88, -89, -89, -89, -89, -89, -90, -91, -91, -91, -92, -92, -92, -94]"
signal_20260108_1624.csv,"['Lte', 'Lte', 'Lte', 'Lte']","[317, 316, 357, 358]","[-79, -90, -129, -128]","[48:8f:4c:9d:57:66, 7c:25:da:f2:d6:64, 58:56:c2:5b:fa:43, 58:56:c2:5b:fa:42, 58:56:c2:5b:fa:46, 6c:59:76:2b:cd:0f, 58:56:c2:5b:fa:45, 58:56:c2:5b:fa:44, 58:56:c2:5b:fa:41, 58:56:c2:5b:fa:47, 68:8f:c1:e2:f0:16, 58:c4:1e:76:9c:d7, b8:3a:08:53:69:99, ec:41:f9:72:e5:b6, 70:3a:73:03:80:81, 58:56:c2:5b:fa:40]","[BYD_DVR_9D5766, CAR-DVR-d664, IKEA WIFI, WirelessICC, WirelessLocal, SVWSBCD0F, WirelessDS, WirelessLocal_IO, WirelessMobile, IKEA APP, LSA_f016, , Tenda_536998, HIKVISION-C6LITE-SEHL, BOYOL-RF, WirelessSGF]","[-76, -82, -85, -86, -87, -88, -88, -88, -89, -89, -90, -90, -90, -91, -91, -91]"
signal_20260108_1624.csv,"['Lte', 'Lte', 'Lte', 'Lte']","[317, 316, 358, 357]","[-76, -90, -128, -128]","[48:8f:4c:9d:57:66, 7c:25:da:f2:d6:64, 58:56:c2:5b:ef:04, 58:56:c2:5b:ef:06, 58:56:c2:5b:ef:02, 58:56:c2:5b:ef:03, 58:56:c2:5b:ef:07, 58:56:c2:5b:ef:00, 58:56:c2:5b:ef:01, 58:56:c2:5b:ef:05, 70:3a:73:0b:80:81, 58:c4:1e:76:9c:d7, 70:3a:73:03:80:81, 6c:59:76:2b:cd:0f]","[BYD_DVR_9D5766, CAR-DVR-d664, WirelessLocal_IO, WirelessLocal, WirelessICC, IKEA WIFI, IKEA APP, WirelessSGF, WirelessMobile, WirelessDS, BOYOL-Office, , BOYOL-RF, SVWSBCD0F]","[-67, -84, -85, -86, -86, -86, -86, -87, -87, -88, -88, -90, -92, -94]"
signal_20260108_1624.csv,"['Lte', 'Lte', 'Lte', 'Lte']","[317, 316, 358, 357]","[-84, -97, -128, -128]","[48:8f:4c:9d:57:66, 68:8f:c1:e2:f0:16, 58:56:c2:5b:fa:47, 58:56:c2:5b:fa:42, 58:56:c2:5b:fa:45, 58:56:c2:5b:fa:44, 58:56:c2:5b:fa:46, 58:56:c2:5b:fa:43, 58:56:c2:5b:fa:40, 58:56:c2:5b:ef:05, 58:56:c2:5b:ef:06, 58:56:c2:5b:fa:41, 58:56:c2:5b:ef:02, 58:56:c2:5b:ef:03, 58:56:c2:5b:ef:00, 58:56:c2:5b:ef:01, 58:56:c2:5b:ef:04, 58:56:c2:5b:ef:07, 5c:a0:01:75:b9:5e, 66:c5:59:19:62:f6]","[BYD_DVR_9D5766, LSA_f016, IKEA APP, WirelessICC, WirelessDS, WirelessLocal_IO, WirelessLocal, IKEA WIFI, WirelessSGF, WirelessDS, WirelessLocal, WirelessMobile, WirelessICC, IKEA WIFI, WirelessSGF, WirelessMobile, WirelessLocal_IO, IKEA APP, MIFI-B95E, 木子M]","[-63, -84, -84, -85, -85, -85, -85, -86, -86, -86, -87, -87, -89, -89, -90, -90, -90, -90, -92, -92]"
signal_20260108_1624.csv,"['Lte', 'Lte', 'Lte', 'Lte']","[317, 316, 358, 357]","[-85, -92, -128, -128]","[48:8f:4c:9d:57:66, 58:56:c2:5b:fa:43, 58:56:c2:5b:fa:45, 58:56:c2:5b:fa:44, 58:56:c2:5b:fa:41, 58:56:c2:5b:fa:40, 58:56:c2:5b:fa:47, 58:56:c2:5b:fa:46, 58:56:c2:5b:fa:42, 58:56:c2:5b:ef:03, 72:ae:fd:76:8b:3c, 58:56:c2:5b:fa:51, 68:8f:c1:e2:f0:16, 58:56:c2:5b:fa:50, 58:56:c2:5b:fa:53, 58:56:c2:5b:fa:54, 58:56:c2:5b:fa:55, 58:56:c2:5b:fa:56, 58:56:c2:5b:fa:52, ec:41:f9:72:e5:b6, 58:56:c2:5b:ef:06, 70:3a:73:03:80:81, 58:56:c2:5b:ef:01, 58:56:c2:5b:ef:05, 58:56:c2:5b:fa:57, 58:56:c2:5b:ef:00, 58:56:c2:5b:ef:04, 58:56:c2:5b:ef:07, 58:56:c2:5b:ef:02, 58:56:c2:5c:00:e3, 66:c5:59:19:62:f6]","[BYD_DVR_9D5766, IKEA WIFI, WirelessDS, WirelessLocal_IO, WirelessMobile, WirelessSGF, IKEA APP, WirelessLocal, WirelessICC, IKEA WIFI, DIRECT-f7e3-1267, WirelessMobile, LSA_f016, WirelessSGF, IKEA WIFI, WirelessLocal_IO, WirelessDS, WirelessLocal, WirelessICC, HIKVISION-C6LITE-SEHL, WirelessLocal, BOYOL-RF, WirelessMobile, WirelessDS, IKEA APP, WirelessSGF, WirelessLocal_IO, IKEA APP, WirelessICC, IKEA WIFI, 木子M]","[-68, -80, -80, -80, -80, -80, -80, -80, -81, -84, -87, -87, -88, -88, -88, -88, -88, -88, -88, -89, -89, -89, -89, -89, -89, -90, -90, -91, -92, -92, -95]"
signal_20260108_1624.csv,"['Lte', 'Lte', 'Lte', 'Lte']","[317, 316, 358, 357]","[-81, -96, -128, -130]","[48:8f:4c:9d:57:66, 7c:25:da:f2:d6:64, 68:8f:c1:e2:f0:16, 72:ae:fd:76:8b:3c, 58:56:c2:5b:fa:43, 58:56:c2:5b:fa:46, 58:56:c2:5b:fa:44, 58:56:c2:5b:fa:40]","[BYD_DVR_9D5766, CAR-DVR-d664, LSA_f016, DIRECT-f7e3-1267, IKEA WIFI, WirelessLocal, WirelessLocal_IO, WirelessSGF]","[-77, -79, -87, -88, -88, -88, -89, -89]"
signal_20260108_1624.csv,"['Lte', 'Lte', 'Lte', 'Lte']","[317, 316, 358, 357]","[-79, -90, -128, -130]","[48:8f:4c:9d:57:66, 70:3a:73:03:80:81, ec:41:f9:72:e5:b6, 58:56:c2:5c:01:02, 68:8f:c1:e2:f0:16, 58:56:c2:5c:01:04, 58:56:c2:5c:01:05, 58:56:c2:5c:01:06, 58:56:c2:5c:01:07, 58:56:c2:5c:01:03, 58:56:c2:5c:01:01, 58:56:c2:5c:01:00, 58:56:c2:5b:fa:44, 58:56:c2:5b:fa:42, 58:56:c2:5b:fa:47, 58:56:c2:5b:fa:46, c0:e0:18:e5:f2:d2, 68:4e:05:a5:00:a8, c0:e0:18:e5:f2:d0, c0:e0:18:e5:f2:d1, c0:e0:18:e5:f2:d4, c0:e0:18:e5:f2:d5]","[BYD_DVR_9D5766, BOYOL-RF, HIKVISION-C6LITE-SEHL, WirelessICC, LSA_f016, WirelessLocal_IO, WirelessDS, WirelessLocal, IKEA APP, IKEA WIFI, WirelessMobile, WirelessSGF, WirelessLocal_IO, WirelessICC, IKEA APP, WirelessLocal, WirelessICC, 360行车记录仪G300Pro-282C, WirelessSGF, WirelessMobile, WirelessLocal_IO, WirelessDS]","[-60, -82, -85, -85, -86, -87, -87, -87, -87, -87, -87, -87, -90, -91, -91, -92, -92, -93, -93, -93, -93, -94]"
signal_20260108_1624.csv,"['Lte', 'Lte', 'Lte']","[317, 358, 357]","[-79, -128, -130]","[48:8f:4c:9d:57:66, 28:3b:82:85:83:7c, 58:56:c2:5c:01:03, 58:56:c2:5c:01:04, 58:56:c2:5c:01:05, 58:56:c2:5c:01:00, 68:4e:05:a5:00:a8, c0:e0:18:e5:f2:51, c0:e0:18:e5:f2:53, c0:e0:18:e5:f2:54, c0:e0:18:e5:f2:55, c0:e0:18:e5:f2:56, c0:e0:18:e5:f2:57, 68:8f:c1:e2:f0:16, 70:3a:73:03:80:81, c0:e0:18:e5:f2:52, 70:3a:73:03:80:6f, b8:3a:08:53:69:99]","[BYD_DVR_9D5766, , IKEA WIFI, WirelessLocal_IO, WirelessDS, WirelessSGF, 360行车记录仪G300Pro-282C, WirelessMobile, IKEA WIFI, WirelessLocal_IO, WirelessDS, WirelessLocal, IKEA APP, LSA_f016, BOYOL-RF, WirelessICC, BOYOL-RF, Tenda_536998]","[-68, -83, -84, -85, -85, -85, -88, -88, -88, -88, -89, -89, -89, -90, -90, -90, -92, -92]"
signal_20260108_1624.csv,"['Lte', 'Lte', 'Lte']","[317, 358, 357]","[-76, -128, -130]","[48:8f:4c:9d:57:66, 58:56:c2:5c:01:02, 58:56:c2:5c:01:03, ec:41:f9:72:e5:b6, 58:56:c2:5c:01:07, c0:e0:18:e5:f2:50, 68:4e:05:a5:00:a8, 58:56:c2:5c:01:00, 70:3a:73:03:80:81, 58:56:c2:5c:01:01, c0:e0:18:e5:f2:54, c0:e0:18:e5:f2:55, c0:e0:18:e5:f2:56, c0:e0:18:e5:f2:57, 70:3a:73:03:80:6f, c0:e0:18:e5:f2:51, c0:e0:18:e5:f2:52, c0:e0:18:e5:f2:53, c0:e0:18:e5:f2:d4, 58:56:c2:5c:00:e1, b8:3a:08:53:69:99, c0:e0:18:e5:f2:d6, c0:e0:18:e5:f2:d7]","[BYD_DVR_9D5766, WirelessICC, IKEA WIFI, HIKVISION-C6LITE-SEHL, IKEA APP, WirelessSGF, 360行车记录仪G300Pro-282C, WirelessSGF, BOYOL-RF, WirelessMobile, WirelessLocal_IO, WirelessDS, WirelessLocal, IKEA APP, BOYOL-RF, WirelessMobile, WirelessICC, IKEA WIFI, WirelessLocal_IO, WirelessMobile, Tenda_536998, WirelessLocal, IKEA APP]","[-53, -83, -84, -87, -88, -88, -89, -89, -90, -90, -90, -90, -90, -90, -90, -91, -91, -91, -93, -93, -94, -94, -94]"
signal_20260108_1624.csv,"['Lte', 'Lte', 'Lte']","[317, 358, 357]","[-75, -129, -128]","[48:8f:4c:9d:57:66, 68:8f:c1:e2:f0:16, ec:41:f9:72:e5:b6, c0:e0:18:e5:f2:54, c0:e0:18:e5:f2:56, c0:e0:18:e5:f2:50, 58:56:c2:5c:01:01, 58:56:c2:5c:01:02, c0:e0:18:e5:f2:51, c0:e0:18:e5:f2:52, c0:e0:18:e5:f2:53, 70:3a:73:03:80:81, c0:e0:18:e5:f2:55, c0:e0:18:e5:f2:d4, c0:e0:18:e5:f2:d5, c0:e0:18:e5:f2:57, c0:e0:18:e5:f2:d1, c0:e0:18:e5:f2:d0, c0:e0:18:e5:f2:d2, c0:e0:18:e5:f2:d3, c0:e0:18:e5:f2:d7, fa:6b:14:f9:9b:25, 58:c4:1e:76:9c:d7]","[BYD_DVR_9D5766, LSA_f016, HIKVISION-C6LITE-SEHL, WirelessLocal_IO, WirelessLocal, WirelessSGF, WirelessMobile, WirelessICC, WirelessMobile, WirelessICC, IKEA WIFI, BOYOL-RF, WirelessDS, WirelessLocal_IO, WirelessDS, IKEA APP, WirelessMobile, WirelessSGF, WirelessICC, IKEA WIFI, IKEA APP, 汪ls6, ]","[-47, -80, -81, -85, -85, -86, -87, -87, -87, -87, -87, -88, -88, -89, -89, -89, -90, -91, -91, -91, -92, -92, -93]"
signal_20260108_1624.csv,"['Lte', 'Lte', 'Lte']","[317, 358, 357]","[-79, -129, -128]","[48:8f:4c:9d:57:66, 70:3a:73:03:80:81, 68:8f:c1:e2:f0:16, ec:41:f9:72:e5:b6, 70:3a:73:0b:80:81, 58:56:c2:5c:01:04, 58:56:c2:5c:01:07, 48:0e:ec:84:24:b3, 58:56:c2:5c:01:02, 58:56:c2:5c:01:05, 58:56:c2:5c:01:06, 58:56:c2:5c:01:01, 58:56:c2:5c:01:03, 32:3f:3b:ea:68:2f, 68:4e:05:a5:00:a8, c0:e0:18:e5:f2:57, c0:e0:18:e5:f2:50, c0:e0:18:e5:f2:54, c0:e0:18:e5:f2:53, c0:e0:18:e5:f2:55, 2a:c8:7c:18:26:2f]","[BYD_DVR_9D5766, BOYOL-RF, LSA_f016, HIKVISION-C6LITE-SEHL, BOYOL-Office, WirelessLocal_IO, IKEA APP, TP-LINK_24B3, WirelessICC, WirelessDS, WirelessLocal, WirelessMobile, IKEA WIFI, 吃饭, 360行车记录仪G300Pro-282C, IKEA APP, WirelessSGF, WirelessLocal_IO, IKEA WIFI, WirelessDS, iTV-hJUq]","[-50, -81, -82, -83, -84, -85, -86, -86, -87, -88, -88, -88, -89, -89, -90, -90, -90, -91, -92, -93, -94]"
signal_20260108_1624.csv,"['Lte', 'Lte', 'Lte']","[317, 358, 357]","[-80, -129, -128]","[48:8f:4c:9d:57:66, 28:3b:82:85:83:7c, ec:41:f9:72:e5:b6, 70:3a:73:03:80:81, 70:3a:73:0b:80:81, 32:3f:3b:ea:68:2f, 58:56:c2:5c:01:06, 58:56:c2:5c:01:07, ca:50:e9:f2:3a:0c, c0:e0:18:e5:f2:d6, c0:e0:18:e5:f2:54, c0:e0:18:e5:f2:d5, c0:e0:18:e5:f2:53, c0:e0:18:e5:f2:55, c0:e0:18:e5:f2:d1, c0:e0:18:e5:f2:d2, c0:e0:18:e5:f2:d4, c0:e0:18:e5:f2:d3, c0:e0:18:e5:f2:d0, 22:c3:43:be:99:37]","[BYD_DVR_9D5766, , HIKVISION-C6LITE-SEHL, BOYOL-RF, BOYOL-Office, 吃饭, WirelessLocal, IKEA APP, ChinaNet-rt1v, WirelessLocal, WirelessLocal_IO, WirelessDS, IKEA WIFI, WirelessDS, WirelessMobile, WirelessICC, WirelessLocal_IO, IKEA WIFI, WirelessSGF, Xiaomi SU7_266697]","[-47, -73, -79, -80, -81, -84, -87, -88, -88, -89, -90, -91, -91, -91, -92, -92, -92, -92, -93, -93]"
signal_20260108_1624.csv,"['Lte', 'Lte', 'Lte']","[317, 358, 357]","[-81, -129, -128]","[48:8f:4c:9d:57:66, ec:41:f9:72:e5:b6, 32:3f:3b:ea:68:2f, 70:3a:73:0b:80:81, ca:50:e9:f2:3a:0c, c0:e0:18:ae:ef:a0, c0:e0:18:ae:ef:a2, c0:e0:18:ae:ef:a5, fa:6b:14:f9:9b:25, c0:e0:18:ae:ef:a1, c0:e0:18:ae:ef:a3, c0:e0:18:ae:ef:a4, c0:e0:18:ae:ef:a7, 10:8f:fe:25:3d:14]","[BYD_DVR_9D5766, HIKVISION-C6LITE-SEHL, 吃饭, BOYOL-Office, ChinaNet-rt1v, WirelessSGF, WirelessICC, WirelessDS, 汪ls6, WirelessMobile, IKEA WIFI, WirelessLocal_IO, IKEA APP, WirelessLocal_IO]","[-52, -82, -85, -87, -88, -88, -88, -90, -91, -91, -91, -92, -92, -93]"
signal_20260108_1624.csv,"['Lte', 'Lte', 'Lte']","[317, 357, 358]","[-82, -131, -127]","[48:8f:4c:9d:57:66, 68:8f:c1:e2:f0:16, 70:3a:73:03:80:81, 70:3a:73:0b:80:81, 48:0e:ec:84:24:b3, c0:e0:18:e5:f2:d3, 70:3a:73:0b:80:6f, ec:41:f9:72:e5:b6, 68:4e:05:a5:00:a8, c0:e0:18:e5:f2:d1, c0:e0:18:e5:f2:d7, c0:e0:18:e5:f2:d2, c0:e0:18:e5:f2:d4, c0:e0:18:e5:f2:d5, c0:e0:18:ae:ef:a1, c0:e0:18:e5:f2:d0, c0:e0:18:e5:f2:d6, 32:3f:3b:ea:68:2f, 22:c3:43:be:99:37]","[BYD_DVR_9D5766, LSA_f016, BOYOL-RF, BOYOL-Office, TP-LINK_24B3, IKEA WIFI, BOYOL-Office, HIKVISION-C6LITE-SEHL, 360行车记录仪G300Pro-282C, WirelessMobile, IKEA APP, WirelessICC, WirelessLocal_IO, WirelessDS, WirelessMobile, WirelessSGF, WirelessLocal, 吃饭, Xiaomi SU7_266697]","[-54, -80, -83, -84, -86, -89, -89, -90, -90, -90, -90, -91, -91, -91, -91, -92, -92, -94, -94]"
signal_20260108_1624.csv,"['Lte', 'Lte', 'Lte']","[317, 357, 358]","[-86, -131, -127]","[48:8f:4c:9d:57:66, 28:3b:82:85:83:7c, c0:e0:18:e5:f2:d4, c0:e0:18:e5:f2:d5, c0:e0:18:e5:f2:d6, c0:e0:18:e5:f2:d0, c0:e0:18:e5:f2:d1, c0:e0:18:e5:f2:d2, c0:e0:18:e5:f2:d7, c0:e0:18:e5:f2:d3, 68:8f:c1:e2:f0:16, 70:3a:73:03:80:81, 32:3f:3b:ea:68:2f, 70:3a:73:0b:80:81, ca:50:e9:f2:3a:0c, 70:3a:73:0b:80:6f, fa:6b:14:f2:9b:25, 22:c3:43:be:99:37]","[BYD_DVR_9D5766, , WirelessLocal_IO, WirelessDS, WirelessLocal, WirelessSGF, WirelessMobile, WirelessICC, IKEA APP, IKEA WIFI, LSA_f016, BOYOL-RF, 吃饭, BOYOL-Office, ChinaNet-rt1v, BOYOL-Office, 汪ls6, Xiaomi SU7_266697]","[-62, -75, -76, -76, -76, -77, -77, -77, -77, -77, -78, -81, -85, -86, -89, -89, -90, -92]"
signal_20260108_1624.csv,"['Lte', 'Lte', 'Lte']","[317, 357, 358]","[-85, -131, -127]","[48:8f:4c:9d:57:66, 70:3a:73:0b:80:81, 70:3a:73:03:80:81, c0:e0:18:e5:f2:d6, c0:e0:18:e5:f2:d1, c0:e0:18:e5:f2:d2, c0:e0:18:e5:f2:d5, c0:e0:18:e5:f2:d3, 68:8f:c1:e2:f0:16, c0:e0:18:e5:f2:d0, c0:e0:18:e5:f2:d4, c0:e0:18:e5:f2:d7, 70:3a:73:0b:80:6f, ca:50:e9:f2:3a:0c, ec:41:f9:72:e5:b6, c0:e0:18:ae:ef:a4, 68:4e:05:a5:00:a8, fa:6b:14:f9:9b:25, c0:e0:18:ae:ef:a0, c0:e0:18:ae:ef:a6, c0:e0:18:ae:ef:a5]","[BYD_DVR_9D5766, BOYOL-Office, BOYOL-RF, WirelessLocal, WirelessMobile, WirelessICC, WirelessDS, IKEA WIFI, LSA_f016, WirelessSGF, WirelessLocal_IO, IKEA APP, BOYOL-Office, ChinaNet-rt1v, HIKVISION-C6LITE-SEHL, WirelessLocal_IO, 360行车记录仪G300Pro-282C, 汪ls6, WirelessSGF, WirelessLocal, WirelessDS]","[-62, -74, -75, -76, -77, -77, -77, -77, -78, -78, -78, -78, -82, -84, -85, -85, -88, -88, -92, -92, -93]"
signal_20260108_1624.csv,"['Lte', 'Lte', 'Lte']","[317, 357, 358]","[-85, -131, -127]","[48:8f:4c:9d:57:66, 68:8f:c1:e2:f0:16, 70:3a:73:03:80:81, 70:3a:73:0b:80:6f, 70:3a:73:0b:80:81, c0:e0:18:e5:f2:e4, 48:0e:ec:84:24:b3, c0:e0:18:e5:f2:e5, 32:3f:3b:ea:68:2f, c0:e0:18:e5:f2:e6, c0:e0:18:e5:f2:e7, 70:3a:73:83:80:81, c0:e0:18:e5:f2:d4, 22:c3:43:be:99:37, 24:18:c6:b9:da:d3, a8:0c:ca:08:26:e2, fa:6b:14:f2:9b:25, e0:bb:9e:96:07:64]","[BYD_DVR_9D5766, LSA_f016, BOYOL-RF, BOYOL-Office, BOYOL-Office, WirelessLocal_IO, TP-LINK_24B3, WirelessDS, 吃饭, WirelessLocal, IKEA APP, BOYOL-Office, WirelessLocal_IO, Xiaomi SU7_266697, Mars, BOYOL-Office, 汪ls6, EB960764-uE8BkUbWTa1AOAg]","[-69, -72, -78, -79, -81, -83, -84, -84, -85, -85, -85, -85, -86, -87, -87, -88, -91, -92]"
signal_20260108_1624.csv,"['Lte', 'Lte', 'Lte']","[317, 358, 357]","[-82, -129, -129]","[48:8f:4c:9d:57:66, 70:3a:73:03:80:81, 70:3a:73:0b:80:81, 70:3a:73:83:80:81, 48:0e:ec:84:24:b3, ec:41:f9:72:e5:b6, 70:3a:73:0b:80:6f, 32:3f:3b:ea:68:2f, c0:e0:18:e5:f1:96, fa:6b:14:f9:9b:25, ca:50:e9:f2:3a:0c, a8:0c:ca:08:26:e2, 68:4e:05:a5:00:a8, 58:c4:1e:76:9c:d7, fa:6b:14:f2:9b:25, c0:e0:18:e5:f2:e6, c8:a9:79:62:1a:60]","[BYD_DVR_9D5766, BOYOL-RF, BOYOL-Office, BOYOL-Office, TP-LINK_24B3, HIKVISION-C6LITE-SEHL, BOYOL-Office, 吃饭, WirelessLocal, 汪ls6, ChinaNet-rt1v, BOYOL-Office, 360行车记录仪G300Pro-282C, , 汪ls6, WirelessLocal, BD_WIFI_601a62]","[-65, -76, -78, -78, -79, -81, -82, -83, -84, -86, -87, -87, -88, -88, -89, -89, -91]"
signal_20260108_1624.csv,"['Lte', 'Lte', 'Lte']","[317, 358, 357]","[-82, -129, -129]","[48:8f:4c:9d:57:66, 70:3a:73:03:80:81, 70:3a:73:0b:80:81, 68:8f:c1:e2:f0:16, 70:3a:73:83:80:81, 70:3a:73:0b:80:6f, 28:3b:82:85:83:7c, 48:0e:ec:84:24:b3, 70:3a:73:03:80:6f, ec:41:f9:72:e5:b6, fa:6b:14:f9:9b:25, 32:3f:3b:ea:68:2f, c0:e0:18:e5:f2:d0, fa:6b:14:f2:9b:25, 68:4e:05:a5:00:a8, c0:e0:18:e5:f1:a1, c0:e0:18:e5:f2:e4, c0:e0:18:e5:f2:e5, c0:e0:18:e5:f1:a4, c0:e0:18:e5:f1:a5, c0:e0:18:e5:f1:a7, 22:c3:43:be:99:37, 58:c4:1e:76:9c:d7, c0:e0:18:e5:f1:96, ca:50:e9:f2:3a:0c, c0:e0:18:e5:f1:a0, c0:e0:18:e5:f1:a2, c0:e0:18:e5:f1:a6, c0:e0:18:e5:f2:d5, c0:e0:18:e5:f2:d6, c0:e0:18:e5:f2:d7, c0:e0:18:e5:f1:97, c0:e0:18:e5:f2:d1, c0:e0:18:e5:f2:d4]","[BYD_DVR_9D5766, BOYOL-RF, BOYOL-Office, LSA_f016, BOYOL-Office, BOYOL-Office, , TP-LINK_24B3, BOYOL-RF, HIKVISION-C6LITE-SEHL, 汪ls6, 吃饭, WirelessSGF, 汪ls6, 360行车记录仪G300Pro-282C, WirelessMobile, WirelessLocal_IO, WirelessDS, WirelessLocal_IO, WirelessDS, IKEA APP, Xiaomi SU7_266697, , WirelessLocal, ChinaNet-rt1v, WirelessSGF, WirelessICC, WirelessLocal, WirelessDS, WirelessLocal, IKEA APP, IKEA APP, WirelessMobile, WirelessLocal_IO]","[-63, -69, -69, -74, -75, -77, -79, -79, -79, -82, -84, -84, -85, -87, -88, -88, -89, -89, -89, -89, -89, -90, -90, -90, -91, -91, -91, -91, -92, -92, -92, -92, -93, -93]"
