Time,Cell_Type,Cell_ID,Cell_RSSI,WiFi_MAC,WiFi_ID,WiFi_RSSI
signal_20260108_1624.csv,"['Lte', 'Lte', 'Lte']","[317, 314, 309]","[-74, -84, -104]","[10:8f:fe:af:9f:13, 8e:65:26:2e:6a:12, 10:8f:fe:af:9f:17, 10:8f:fe:af:9f:15, 10:8f:fe:af:9f:10, 10:8f:fe:af:9f:12, 10:8f:fe:af:9f:16, 10:8f:fe:af:9f:11, 10:8f:fe:af:9f:14, 10:8f:fe:af:9f:21, 10:8f:fe:af:9f:22, 10:8f:fe:af:9f:23, 10:8f:fe:af:9f:24, 10:8f:fe:af:9f:26, 10:8f:fe:af:9f:20, 10:8f:fe:af:9f:25, 10:8f:fe:af:9f:27, 10:8f:fe:af:a0:54, 10:8f:fe:af:a0:57, 10:8f:fe:af:a0:51, 10:8f:fe:af:a0:52, 10:8f:fe:af:a0:50, 8c:53:c3:cf:4f:a2, 10:8f:fe:af:9f:d3, 10:8f:fe:af:9f:d7, 32:08:71:f8:99:53, 10:8f:fe:af:9f:d2, 10:8f:fe:af:9f:d5, 10:8f:fe:af:9f:d6, c0:e0:18:e5:e9:56, 82:5b:11:17:34:86, c0:e0:18:e5:e9:51, c0:e0:18:e5:e9:50, c0:e0:18:e5:e9:55, 10:8f:fe:af:9f:d1]","[IKEA WIFI, Redmi Note 12 Turbo, IKEA APP, WirelessDS, WirelessSGF, WirelessICC, WirelessLocal, WirelessMobile, WirelessLocal_IO, WirelessMobile, WirelessICC, IKEA WIFI, WirelessLocal_IO, WirelessLocal, WirelessSGF, WirelessDS, IKEA APP, WirelessLocal_IO, IKEA APP, WirelessMobile, WirelessICC, WirelessSGF, HFB111213, IKEA WIFI, IKEA APP, Xiaomi SU7_333639, WirelessICC, WirelessDS, WirelessLocal, WirelessLocal, Xiaomi SU7_408264, WirelessMobile, WirelessSGF, WirelessDS, WirelessMobile]","[-75, -76, -76, -76, -76, -77, -77, -77, -78, -83, -84, -85, -85, -85, -85, -85, -85, -87, -87, -87, -88, -88, -88, -89, -90, -91, -91, -91, -91, -92, -92, -92, -93, -93, -94]"
signal_20260108_1624.csv,"['Lte', 'Lte', 'Lte']","[317, 314, 309]","[-78, -87, -104]","[8e:65:26:2e:6a:12, 10:8f:fe:af:9f:16, 10:8f:fe:af:9f:15, 10:8f:fe:af:9f:13, 10:8f:fe:af:9f:12, 10:8f:fe:af:9f:10, 10:8f:fe:af:9f:23, 10:8f:fe:af:9f:22, 10:8f:fe:af:9f:25, 10:8f:fe:af:9f:14, 10:8f:fe:af:9f:17, 10:8f:fe:af:9f:11, 10:8f:fe:af:9f:24, 10:8f:fe:af:9f:26, 10:8f:fe:af:9f:20, 10:8f:fe:af:9f:21, 10:8f:fe:af:9f:27, 10:8f:fe:af:a0:15, 8c:53:c3:cf:4f:a2, 10:8f:fe:af:a0:52, 10:8f:fe:af:a0:53, 10:8f:fe:af:a0:54, c0:e0:18:e5:e9:50, c0:e0:18:e5:e9:54]","[Redmi Note 12 Turbo, WirelessLocal, WirelessDS, IKEA WIFI, WirelessICC, WirelessSGF, IKEA WIFI, WirelessICC, WirelessDS, WirelessLocal_IO, IKEA APP, WirelessMobile, WirelessLocal_IO, WirelessLocal, WirelessSGF, WirelessMobile, IKEA APP, WirelessDS, HFB111213, WirelessICC, IKEA WIFI, WirelessLocal_IO, WirelessSGF, WirelessLocal_IO]","[-78, -82, -82, -82, -83, -83, -83, -83, -83, -84, -84, -84, -84, -84, -84, -84, -84, -89, -90, -92, -92, -94, -94, -95]"
signal_20260108_1624.csv,"['Lte', 'Lte', 'Lte']","[317, 314, 309]","[-76, -88, -101]","[8e:65:26:2e:6a:12, 10:8f:fe:af:9f:26, 10:8f:fe:af:9f:20, 10:8f:fe:af:9f:16, 10:8f:fe:af:9f:11, 10:8f:fe:af:9f:15, 10:8f:fe:af:9f:10, 10:8f:fe:af:9f:23, 10:8f:fe:af:9f:24, 10:8f:fe:af:9f:21, 10:8f:fe:af:9f:22, 10:8f:fe:af:9f:27, 10:8f:fe:af:9f:14, 10:8f:fe:af:9f:12, 10:8f:fe:af:9f:17, 10:8f:fe:af:9f:13, 10:8f:fe:af:9f:25, d0:aa:5f:eb:56:b3, 10:8f:fe:af:9f:d1, 10:8f:fe:af:9f:d2, 10:8f:fe:af:9f:d0]","[Redmi Note 12 Turbo, WirelessLocal, WirelessSGF, WirelessLocal, WirelessMobile, WirelessDS, WirelessSGF, IKEA WIFI, WirelessLocal_IO, WirelessMobile, WirelessICC, IKEA APP, WirelessLocal_IO, WirelessICC, IKEA APP, IKEA WIFI, WirelessDS, , WirelessMobile, WirelessICC, WirelessSGF]","[-68, -80, -80, -81, -81, -81, -81, -81, -81, -81, -81, -81, -82, -82, -82, -82, -82, -85, -89, -89, -89]"
signal_20260108_1624.csv,"['Lte', 'Lte', 'Lte']","[317, 314, 309]","[-84, -97, -101]","[8e:65:26:2e:6a:12, 10:8f:fe:af:9f:11, 10:8f:fe:af:9f:14, 10:8f:fe:af:9f:12, 10:8f:fe:af:9f:16, 10:8f:fe:af:9f:17, 10:8f:fe:af:9f:15, 10:8f:fe:af:9f:13, 10:8f:fe:af:9f:10, 10:8f:fe:af:9f:23, 10:8f:fe:af:9f:26, 10:8f:fe:af:9f:20, 10:8f:fe:af:9f:25, 10:8f:fe:af:9f:24, 10:8f:fe:af:9f:27, c0:e0:18:e5:dc:54, c0:e0:18:e5:dc:57, 10:8f:fe:af:9f:d5, 42:45:a0:54:1d:53, 3c:a3:7e:e4:63:b5, 3c:a3:7e:e4:63:b7, c0:e0:18:e5:dc:52, 3c:a3:7e:e4:63:b1, 3c:a3:7e:e4:63:b6, c0:e0:18:e5:dc:56]","[Redmi Note 12 Turbo, WirelessMobile, WirelessLocal_IO, WirelessICC, WirelessLocal, IKEA APP, WirelessDS, IKEA WIFI, WirelessSGF, IKEA WIFI, WirelessLocal, WirelessSGF, WirelessDS, WirelessLocal_IO, IKEA APP, WirelessLocal_IO, IKEA APP, WirelessDS, DIRECT-ZO-8iVJsn, WirelessDS, IKEA APP, WirelessICC, WirelessMobile, WirelessLocal, WirelessLocal]","[-72, -72, -73, -73, -73, -73, -73, -73, -73, -79, -79, -79, -79, -80, -80, -88, -88, -89, -89, -90, -90, -90, -91, -91, -92]"
signal_20260108_1624.csv,"['Lte', 'Lte', 'Lte']","[317, 314, 309]","[-79, -86, -101]","[8e:65:26:2e:6a:12, 10:8f:fe:af:9f:10, 10:8f:fe:af:9f:14, 10:8f:fe:af:9f:12, 10:8f:fe:af:9f:16, 10:8f:fe:af:9f:17, 10:8f:fe:af:9f:11, 10:8f:fe:af:9f:15, 10:8f:fe:af:9f:13, 10:8f:fe:af:9f:23, 10:8f:fe:af:9f:24, 10:8f:fe:af:9f:26, 10:8f:fe:af:9f:20, 10:8f:fe:af:9f:21, 10:8f:fe:af:9f:22, 10:8f:fe:af:9f:25, 10:8f:fe:af:9f:27, 8c:53:c3:cf:4f:a2, 42:45:a0:54:1d:53, 32:08:71:f8:99:53, 10:8f:fe:af:9f:d2, 10:8f:fe:af:a0:57, 10:8f:fe:af:a0:11, 10:8f:fe:af:9f:d5, 10:8f:fe:af:9f:d6, 10:8f:fe:af:9f:d0, 10:8f:fe:af:9f:d1]","[Redmi Note 12 Turbo, WirelessSGF, WirelessLocal_IO, WirelessICC, WirelessLocal, IKEA APP, WirelessMobile, WirelessDS, IKEA WIFI, IKEA WIFI, WirelessLocal_IO, WirelessLocal, WirelessSGF, WirelessMobile, WirelessICC, WirelessDS, IKEA APP, HFB111213, DIRECT-ZO-8iVJsn, Xiaomi SU7_333639, WirelessICC, IKEA APP, WirelessMobile, WirelessDS, WirelessLocal, WirelessSGF, WirelessMobile]","[-68, -75, -76, -76, -76, -76, -76, -76, -76, -81, -81, -81, -81, -81, -82, -82, -83, -86, -87, -88, -89, -90, -90, -93, -93, -93, -94]"
signal_20260108_1624.csv,"['Lte', 'Lte', 'Lte']","[317, 314, 309]","[-80, -87, -101]","[8e:65:26:2e:6a:12, 10:8f:fe:af:9f:14, 10:8f:fe:af:9f:12, 10:8f:fe:af:9f:13, 10:8f:fe:af:9f:10, 10:8f:fe:af:9f:16, 10:8f:fe:af:9f:17, 10:8f:fe:af:9f:11, 10:8f:fe:af:9f:15, 10:8f:fe:af:9f:d7, 10:8f:fe:af:9f:d6, 10:8f:fe:af:9f:24, 10:8f:fe:af:9f:20, 10:8f:fe:af:9f:22, 10:8f:fe:af:9f:25, 32:08:71:f8:99:53, 10:8f:fe:af:9f:26, 10:8f:fe:af:9f:21, 10:8f:fe:af:9f:27, 10:8f:fe:af:9f:23, c0:e0:18:e5:dc:53, 32:f7:8e:f8:99:53, c0:e0:18:e5:dc:50, c0:e0:18:e5:dc:54, 10:8f:fe:af:a0:54, 8c:53:c3:cf:4f:a2, c0:e0:18:e5:dc:56, c0:e0:18:e5:dc:57, 3c:a3:7e:e4:63:b3, c0:e0:18:e5:dc:51, c0:e0:18:e5:dc:55, c0:e0:18:e5:dc:52, 3c:a3:7e:e4:63:b4, 3c:a3:7e:e4:63:b1, 3c:a3:7e:e4:63:b5, 3c:a3:7e:e4:63:b2]","[Redmi Note 12 Turbo, WirelessLocal_IO, WirelessICC, IKEA WIFI, WirelessSGF, WirelessLocal, IKEA APP, WirelessMobile, WirelessDS, IKEA APP, WirelessLocal, WirelessLocal_IO, WirelessSGF, WirelessICC, WirelessDS, Xiaomi SU7_333639, WirelessLocal, WirelessMobile, IKEA APP, IKEA WIFI, IKEA WIFI, Xiaomi SU7_333639, WirelessSGF, WirelessLocal_IO, WirelessLocal_IO, HFB111213, WirelessLocal, IKEA APP, IKEA WIFI, WirelessMobile, WirelessDS, WirelessICC, WirelessLocal_IO, WirelessMobile, WirelessDS, WirelessICC]","[-74, -75, -75, -75, -75, -76, -76, -76, -76, -80, -81, -83, -83, -83, -83, -84, -84, -84, -84, -85, -85, -87, -87, -88, -89, -89, -89, -89, -89, -89, -89, -90, -90, -91, -92, -93]"
signal_20260108_1624.csv,"['Lte', 'Lte', 'Lte']","[317, 309, 309]","[-84, -88, -102]","[10:8f:fe:af:9f:12, 10:8f:fe:af:9f:15, 10:8f:fe:af:9f:17, 10:8f:fe:af:9f:11, 10:8f:fe:af:9f:10, 10:8f:fe:af:9f:14, 10:8f:fe:af:9f:16, 10:8f:fe:af:9f:13, 10:8f:fe:af:9f:d5, 10:8f:fe:af:9f:d0, 10:8f:fe:af:9f:d4, 10:8f:fe:af:9f:d1, 10:8f:fe:af:9f:d2, 10:8f:fe:af:9f:d6, 8c:53:c3:cf:4f:a2, d0:aa:5f:eb:56:b3, 10:8f:fe:af:9f:d7, 10:8f:fe:af:9f:d3, 8e:65:26:2e:6a:12, 10:8f:fe:af:9f:23, 10:8f:fe:af:9f:24, 10:8f:fe:af:9f:22, 10:8f:fe:af:9f:25, 10:8f:fe:af:9f:27, 10:8f:fe:af:9f:26, 10:8f:fe:af:9f:20, 32:08:71:f8:99:53, 10:8f:fe:af:a0:57, c0:e0:18:e5:dc:57, 10:8f:fe:af:9f:e1, 10:8f:fe:af:9f:e5, 10:8f:fe:af:9f:e2, 10:8f:fe:af:9f:e4, 10:8f:fe:af:9f:e6, 10:8f:fe:af:9f:e7, 10:8f:fe:af:a0:51, 10:8f:fe:af:a0:52, 10:8f:fe:af:a0:53, 10:8f:fe:af:a0:54, d2:ec:1f:64:0c:aa, c0:e0:18:e5:dc:54, c0:e0:18:e5:dc:56, c0:e0:18:e5:dc:55]","[WirelessICC, WirelessDS, IKEA APP, WirelessMobile, WirelessSGF, WirelessLocal_IO, WirelessLocal, IKEA WIFI, WirelessDS, WirelessSGF, WirelessLocal_IO, WirelessMobile, WirelessICC, WirelessLocal, HFB111213, , IKEA APP, IKEA WIFI, Redmi Note 12 Turbo, IKEA WIFI, WirelessLocal_IO, WirelessICC, WirelessDS, IKEA APP, WirelessLocal, WirelessSGF, Xiaomi SU7_333639, IKEA APP, IKEA APP, WirelessMobile, WirelessDS, WirelessICC, WirelessLocal_IO, WirelessLocal, IKEA APP, WirelessMobile, WirelessICC, IKEA WIFI, WirelessLocal_IO, DIRECT-Xiaomi SU7_776220, WirelessLocal_IO, WirelessLocal, WirelessDS]","[-69, -75, -76, -76, -76, -77, -77, -77, -79, -80, -80, -81, -81, -81, -81, -81, -81, -81, -83, -83, -84, -85, -85, -85, -86, -86, -87, -88, -88, -89, -89, -90, -90, -90, -90, -90, -90, -90, -91, -91, -92, -93, -93]"
signal_20260108_1624.csv,"['Lte', 'Lte', 'Lte']","[317, 309, 309]","[-86, -84, -102]","[10:8f:fe:af:9f:14, 10:8f:fe:af:9f:16, 10:8f:fe:af:9f:17, d0:aa:5f:eb:56:b3, 10:8f:fe:af:9f:12, 10:8f:fe:af:9f:11, 10:8f:fe:af:9f:13, 8e:65:26:2e:6a:12, 10:8f:fe:af:9f:15, 10:8f:fe:af:9f:10, 10:8f:fe:af:9f:26, 10:8f:fe:af:9f:23, 10:8f:fe:af:9f:22, 10:8f:fe:af:9f:24, 10:8f:fe:af:9f:20, 10:8f:fe:af:9f:21, 10:8f:fe:af:9f:25, 10:8f:fe:af:9f:27, 8c:53:c3:cf:4f:a2, 32:08:71:f8:99:53, 10:8f:fe:af:9f:e2, d2:ec:1f:64:0c:aa, 10:8f:fe:af:9f:e0, 10:8f:fe:af:9f:e1, 10:8f:fe:af:9f:e6, 10:8f:fe:af:9f:e7, 10:8f:fe:af:9f:e3, c0:e0:18:e5:dc:53, 10:8f:fe:af:9f:e4, 10:8f:fe:af:9f:e5, c0:e0:18:e5:dc:50, 10:8f:fe:af:a0:55, c0:e0:18:e5:dc:52]","[WirelessLocal_IO, WirelessLocal, IKEA APP, , WirelessICC, WirelessMobile, IKEA WIFI, Redmi Note 12 Turbo, WirelessDS, WirelessSGF, WirelessLocal, IKEA WIFI, WirelessICC, WirelessLocal_IO, WirelessSGF, WirelessMobile, WirelessDS, IKEA APP, HFB111213, Xiaomi SU7_333639, WirelessICC, DIRECT-Xiaomi SU7_776220, WirelessSGF, WirelessMobile, WirelessLocal, IKEA APP, IKEA WIFI, IKEA WIFI, WirelessLocal_IO, WirelessDS, WirelessSGF, WirelessDS, WirelessICC]","[-80, -80, -80, -80, -81, -81, -81, -82, -82, -82, -83, -84, -84, -85, -85, -85, -85, -85, -86, -89, -89, -89, -89, -90, -90, -90, -90, -91, -91, -91, -93, -94, -95]"
signal_20260108_1624.csv,"['Lte', 'Lte', 'Lte']","[317, 309, 309]","[-87, -83, -102]","[d0:aa:5f:eb:56:b3, 8e:65:26:2e:6a:12, 32:08:71:f8:99:53, 10:8f:fe:af:9f:13, 32:f7:8e:f8:99:53, 10:8f:fe:af:9f:14, 10:8f:fe:af:9f:10, 10:8f:fe:af:9f:12, 10:8f:fe:af:9f:16, 10:8f:fe:af:9f:17, 10:8f:fe:af:9f:11, 10:8f:fe:af:9f:15, 66:e2:20:a2:13:b4, 10:8f:fe:af:9f:e2, 10:8f:fe:af:9f:e5, 10:8f:fe:af:9f:e6, 8c:53:c3:cf:55:06, 10:8f:fe:af:9f:e7, 3c:68:01:76:08:85, c0:e0:18:e5:dc:57, c0:e0:18:e5:dc:52, c0:e0:18:e5:dc:55]","[, Redmi Note 12 Turbo, Xiaomi SU7_333639, IKEA WIFI, Xiaomi SU7_333639, WirelessLocal_IO, WirelessSGF, WirelessICC, WirelessLocal, IKEA APP, WirelessMobile, WirelessDS, DIRECT-BMW 63108, WirelessICC, WirelessDS, WirelessLocal, Xiaomi_5505, IKEA APP, XY016681, IKEA APP, WirelessICC, WirelessDS]","[-73, -81, -83, -85, -85, -86, -86, -87, -87, -88, -88, -88, -89, -90, -90, -90, -90, -91, -91, -92, -95, -95]"
signal_20260108_1624.csv,"['Lte', 'Lte', 'Lte']","[317, 309, 309]","[-84, -82, -113]","[d0:aa:5f:eb:56:b3, 8e:65:26:2e:6a:12, 10:8f:fe:af:9f:11, 10:8f:fe:af:9f:14, 10:8f:fe:af:9f:12, 10:8f:fe:af:9f:17, 10:8f:fe:af:9f:15, 10:8f:fe:af:9f:13, 10:8f:fe:af:9f:16, 32:f7:8e:f8:99:53, 32:08:71:f8:99:53, 10:8f:fe:af:9f:10, 8c:53:c3:cf:4f:a2, d2:ec:1f:64:0c:aa, c0:e0:18:e5:e2:11, c0:e0:18:e5:e2:13, c0:e0:18:e5:e2:14, c0:e0:18:e5:e2:15, c0:e0:18:e5:e2:16, c0:e0:18:e5:e2:12]","[, Redmi Note 12 Turbo, WirelessMobile, WirelessLocal_IO, WirelessICC, IKEA APP, WirelessDS, IKEA WIFI, WirelessLocal, Xiaomi SU7_333639, Xiaomi SU7_333639, WirelessSGF, HFB111213, DIRECT-Xiaomi SU7_776220, WirelessMobile, IKEA WIFI, WirelessLocal_IO, WirelessDS, WirelessLocal, WirelessICC]","[-76, -82, -82, -83, -83, -83, -83, -83, -84, -84, -85, -85, -86, -87, -91, -92, -92, -92, -92, -94]"
signal_20260108_1624.csv,"['Lte', 'Lte', 'Lte']","[317, 309, 309]","[-83, -80, -113]","[d0:aa:5f:eb:56:b3, 8c:53:c3:cf:4f:a2, 8e:65:26:2e:6a:12, ac:64:cf:cb:26:10, 32:f7:8e:f8:99:53, 32:08:71:f8:99:53, 10:8f:fe:af:9f:d5, 10:8f:fe:af:9f:d1, 10:8f:fe:af:9f:d0, d2:ec:1f:64:0c:aa, 10:8f:fe:af:9f:d4, 10:8f:fe:af:9f:d2, 10:8f:fe:af:9f:d3, 10:8f:fe:af:9f:14, 10:8f:fe:af:9f:16, 10:8f:fe:af:9f:11, 10:8f:fe:af:9f:10, 66:e2:20:a2:13:b4, 10:8f:fe:af:9f:12, 10:8f:fe:af:9f:17, 10:8f:fe:af:9f:15, 10:8f:fe:af:9f:13, 10:8f:fe:af:97:13, 10:8f:fe:af:97:10, 10:8f:fe:af:97:11]","[, HFB111213, Redmi Note 12 Turbo, FAW_VW003ac64cfcb2610, Xiaomi SU7_333639, Xiaomi SU7_333639, WirelessDS, WirelessMobile, WirelessSGF, DIRECT-Xiaomi SU7_776220, WirelessLocal_IO, WirelessICC, IKEA WIFI, WirelessLocal_IO, WirelessLocal, WirelessMobile, WirelessSGF, DIRECT-BMW 63108, WirelessICC, IKEA APP, WirelessDS, IKEA WIFI, IKEA WIFI, WirelessSGF, WirelessMobile]","[-70, -73, -78, -78, -82, -83, -86, -87, -87, -87, -87, -88, -88, -89, -89, -89, -89, -89, -90, -90, -90, -90, -92, -93, -93]"
signal_20260108_1624.csv,"['Lte', 'Lte', 'Lte']","[317, 309, 309]","[-86, -84, -113]","[8c:53:c3:cf:4f:a2, 8e:65:26:2e:6a:12, d0:aa:5f:eb:56:b3, ac:64:cf:cb:26:10, 32:f7:8e:f8:99:53, 32:08:71:f8:99:53, d2:ec:1f:64:0c:aa, 66:e2:20:a2:13:b4, 3c:68:01:76:08:85]","[HFB111213, Redmi Note 12 Turbo, , FAW_VW003ac64cfcb2610, Xiaomi SU7_333639, Xiaomi SU7_333639, DIRECT-Xiaomi SU7_776220, DIRECT-BMW 63108, XY016681]","[-65, -78, -78, -78, -79, -81, -83, -86, -87]"
signal_20260108_1624.csv,"['Lte', 'Lte', 'Lte']","[317, 309, 309]","[-91, -84, -113]","[8c:53:c3:cf:4f:a2, d0:aa:5f:eb:56:b3, ac:64:cf:cb:26:10, 32:f7:8e:f8:99:53, d2:ec:1f:64:0c:aa, 8e:65:26:2e:6a:12, 32:08:71:f8:99:53, 66:e2:20:a2:13:b4, 8c:53:c3:cf:4f:a3, 10:8f:fe:af:9f:17, 10:8f:fe:af:9f:13, 10:8f:fe:af:9f:14, 10:8f:fe:af:9f:16, 10:8f:fe:af:9f:11, 10:8f:fe:af:9f:15, 10:8f:fe:af:9f:12, 10:8f:fe:af:9f:10, 8c:53:c3:cf:55:06]","[HFB111213, , FAW_VW003ac64cfcb2610, Xiaomi SU7_333639, DIRECT-Xiaomi SU7_776220, Redmi Note 12 Turbo, Xiaomi SU7_333639, DIRECT-BMW 63108, HFB111213_5G, IKEA APP, IKEA WIFI, WirelessLocal_IO, WirelessLocal, WirelessMobile, WirelessDS, WirelessICC, WirelessSGF, Xiaomi_5505]","[-65, -74, -76, -80, -81, -84, -84, -85, -85, -88, -89, -90, -90, -90, -90, -91, -91, -95]"
signal_20260108_1624.csv,"['Lte', 'Lte', 'Lte']","[309, 317, 309]","[-78, -90, -104]","[d0:aa:5f:eb:56:b3, 8c:53:c3:cf:4f:a2, ac:64:cf:cb:26:10, 32:08:71:f8:99:53, 32:f7:8e:f8:99:53, 66:e2:20:a2:13:b4, 8e:65:26:2e:6a:12, d2:ec:1f:64:0c:aa, 8c:53:c3:cf:55:06, 8c:53:c3:cf:4f:a3, 10:8f:fe:af:9f:e1, 10:8f:fe:af:9f:e2, 3c:68:01:76:08:85, 10:8f:fe:af:9f:e0, 10:8f:fe:af:9f:e3, 10:8f:fe:af:9f:e4, 10:8f:fe:af:9f:e5, 10:8f:fe:af:96:91, 10:8f:fe:af:9f:e6, 10:8f:fe:af:96:93, 10:8f:fe:af:9f:e7, 10:8f:fe:af:96:90, 10:8f:fe:af:96:92, 10:8f:fe:af:96:96, 10:8f:fe:af:96:94, 10:8f:fe:af:96:95]","[, HFB111213, FAW_VW003ac64cfcb2610, Xiaomi SU7_333639, Xiaomi SU7_333639, DIRECT-BMW 63108, Redmi Note 12 Turbo, DIRECT-Xiaomi SU7_776220, Xiaomi_5505, HFB111213_5G, WirelessMobile, WirelessICC, XY016681, WirelessSGF, IKEA WIFI, WirelessLocal_IO, WirelessDS, WirelessMobile, WirelessLocal, IKEA WIFI, IKEA APP, WirelessSGF, WirelessICC, WirelessLocal, WirelessLocal_IO, WirelessDS]","[-57, -72, -76, -77, -78, -78, -82, -82, -87, -88, -88, -88, -89, -89, -89, -89, -89, -89, -90, -90, -91, -91, -91, -91, -92, -92]"
signal_20260108_1624.csv,"['Lte', 'Lte', 'Lte']","[309, 317, 309]","[-78, -88, -104]","[8c:53:c3:cf:4f:a2, 8e:65:26:2e:6a:12, ac:64:cf:cb:26:10, 32:08:71:f8:99:53, d0:aa:5f:eb:56:b3, 32:f7:8e:f8:99:53, 10:8f:fe:af:9f:d1, 10:8f:fe:af:9f:d5, 10:8f:fe:af:9f:d3, 8c:53:c3:cf:55:06, 3c:68:01:76:08:85, 10:8f:fe:af:9f:d0, 10:8f:fe:af:9f:d4, 10:8f:fe:af:9f:d6, 10:8f:fe:af:9f:d7, 10:8f:fe:af:9f:d2, 66:e2:20:a2:13:b4, 10:8f:fe:af:9f:53, ca:be:88:26:d1:88, 10:8f:fe:25:38:96, 10:8f:fe:25:38:90, 10:8f:fe:25:38:94]","[HFB111213, Redmi Note 12 Turbo, FAW_VW003ac64cfcb2610, Xiaomi SU7_333639, , Xiaomi SU7_333639, WirelessMobile, WirelessDS, IKEA WIFI, Xiaomi_5505, XY016681, WirelessSGF, WirelessLocal_IO, WirelessLocal, IKEA APP, WirelessICC, DIRECT-BMW 63108, IKEA WIFI, Xiaomi SU7_572236, WirelessLocal, WirelessSGF, WirelessLocal_IO]","[-68, -78, -78, -79, -79, -81, -84, -84, -84, -84, -84, -85, -85, -85, -85, -86, -86, -89, -90, -90, -91, -92]"
signal_20260108_1624.csv,"['Lte', 'Lte', 'Lte']","[309, 317, 309]","[-79, -92, -104]","[8c:53:c3:cf:4f:a2, 32:08:71:f8:99:53, d0:aa:5f:eb:56:b3, d2:ec:1f:64:0c:aa, 8c:53:c3:cf:55:06, 10:8f:fe:af:9f:d2, 10:8f:fe:af:9f:d1, 10:8f:fe:af:9f:d6, 10:8f:fe:af:97:10, c0:e0:18:e5:e2:11, 10:8f:fe:af:9f:d0, 10:8f:fe:af:9f:d3, 10:8f:fe:af:9f:d4, 10:8f:fe:25:38:95, 66:e2:20:a2:13:35, 8e:65:26:2e:6a:12, 10:8f:fe:af:97:11, c0:e0:18:e5:e2:10, c0:e0:18:e5:e2:12, c0:e0:18:e5:e2:13, c0:e0:18:e5:e2:15, c0:e0:18:e5:e2:16, c0:e0:18:e5:e2:17, 10:8f:fe:af:97:12, 10:8f:fe:af:97:16, 10:8f:fe:af:97:17, 66:e2:20:a2:13:b4, 10:8f:fe:af:97:13, 10:8f:fe:25:38:91, 10:8f:fe:af:96:96, 10:8f:fe:25:38:93, 10:8f:fe:25:38:92, c0:e0:18:e5:e2:14, 58:c4:1e:79:ad:8d]","[HFB111213, Xiaomi SU7_333639, , DIRECT-Xiaomi SU7_776220, Xiaomi_5505, WirelessICC, WirelessMobile, WirelessLocal, WirelessSGF, WirelessMobile, WirelessSGF, IKEA WIFI, WirelessLocal_IO, WirelessDS, DIRECT-BMW 63108, Redmi Note 12 Turbo, WirelessMobile, WirelessSGF, WirelessICC, IKEA WIFI, WirelessDS, WirelessLocal, IKEA APP, WirelessICC, WirelessLocal, IKEA APP, DIRECT-BMW 63108, IKEA WIFI, WirelessMobile, WirelessLocal, IKEA WIFI, WirelessICC, WirelessLocal_IO, ]","[-71, -74, -74, -83, -84, -85, -87, -87, -87, -87, -88, -88, -88, -88, -88, -89, -89, -89, -89, -89, -89, -89, -89, -90, -90, -90, -91, -91, -92, -93, -93, -93, -93, -94]"
signal_20260108_1624.csv,"['Lte', 'Lte', 'Lte']","[309, 317, 309]","[-75, -86, -104]","[d0:aa:5f:eb:56:b3, 8c:53:c3:cf:4f:a2, ac:64:cf:cb:26:10, 10:8f:fe:25:38:93, 32:f7:8e:f8:99:53, 32:08:71:f8:99:53, 10:8f:fe:25:38:90, 10:8f:fe:25:38:92, 10:8f:fe:25:38:91, 66:e2:20:a2:13:35, 66:e2:20:a2:13:b4, 8c:53:c3:cf:55:06, 10:8f:fe:25:38:97, 10:8f:fe:af:91:54, 10:8f:fe:af:91:55, 10:8f:fe:af:91:51, 8e:65:26:2e:6a:12, d2:ec:1f:64:0c:aa, 10:8f:fe:af:91:52, c0:e0:18:e5:e2:10, c0:e0:18:e5:e2:13, c0:e0:18:e5:e2:14, 10:8f:fe:af:91:53, c0:e0:18:e5:e2:16, c0:e0:18:e5:e2:11, c0:e0:18:e5:e2:12, c0:e0:18:e5:e2:15, 18:f2:2c:b3:a0:08, 10:8f:fe:25:3a:90, 10:8f:fe:25:3a:91]","[, HFB111213, FAW_VW003ac64cfcb2610, IKEA WIFI, Xiaomi SU7_333639, Xiaomi SU7_333639, WirelessSGF, WirelessICC, WirelessMobile, DIRECT-BMW 63108, DIRECT-BMW 63108, Xiaomi_5505, IKEA APP, WirelessLocal_IO, WirelessDS, WirelessMobile, Redmi Note 12 Turbo, DIRECT-Xiaomi SU7_776220, WirelessICC, WirelessSGF, IKEA WIFI, WirelessLocal_IO, IKEA WIFI, WirelessLocal, WirelessMobile, WirelessICC, WirelessDS, TP-LINK_A008, WirelessSGF, WirelessMobile]","[-75, -77, -80, -82, -83, -84, -84, -85, -86, -86, -87, -87, -87, -87, -88, -89, -90, -90, -90, -91, -91, -91, -91, -92, -93, -93, -93, -93, -93, -93]"
signal_20260108_1624.csv,"['Lte', 'Lte', 'Lte']","[309, 317, 309]","[-71, -83, -111]","[32:f7:8e:f8:99:53, d0:aa:5f:eb:56:b3, 8c:53:c3:cf:4f:a2, 32:08:71:f8:99:53, d2:ec:1f:64:0c:aa, 66:e2:20:a2:13:b4, 8c:53:c3:cf:55:06, c0:e0:18:e5:e2:10, c0:e0:18:e5:e2:14, c0:e0:18:e5:e2:15, c0:e0:18:e5:e2:16, c0:e0:18:e5:e2:17, ac:64:cf:cb:26:10, c0:e0:18:e5:e2:11, c0:e0:18:e5:e2:12, c0:e0:18:e5:e2:13, 66:e2:20:a2:13:35, 10:8f:fe:af:9f:e6, 10:8f:fe:af:9f:e7, 58:c4:1e:79:ad:8d]","[Xiaomi SU7_333639, , HFB111213, Xiaomi SU7_333639, DIRECT-Xiaomi SU7_776220, DIRECT-BMW 63108, Xiaomi_5505, WirelessSGF, WirelessLocal_IO, WirelessDS, WirelessLocal, IKEA APP, FAW_VW003ac64cfcb2610, WirelessMobile, WirelessICC, IKEA WIFI, DIRECT-BMW 63108, WirelessLocal, IKEA APP, ]","[-72, -77, -79, -80, -81, -82, -83, -83, -83, -83, -83, -83, -84, -84, -84, -85, -88, -89, -90, -93]"
signal_20260108_1624.csv,"['Lte', 'Lte', 'Lte']","[309, 317, 309]","[-73, -88, -111]","[32:f7:8e:f8:99:53, 32:08:71:f8:99:53, d0:aa:5f:eb:56:b3, 8c:53:c3:cf:4f:a2, d2:ec:1f:64:0c:aa, 66:e2:20:a2:13:b4, c0:e0:18:e5:e2:10, 66:e2:20:a2:13:35, c0:e0:18:e5:e2:11, c0:e0:18:e5:e2:12, c0:e0:18:e5:e2:13, c0:e0:18:e5:e2:14, c0:e0:18:e5:e2:15, c0:e0:18:e5:e2:16, c0:e0:18:e5:e2:17, 10:8f:fe:af:97:16, 10:8f:fe:af:97:17, c0:e0:18:e5:e2:23, 10:8f:fe:25:38:90, 10:8f:fe:25:38:94, 10:8f:fe:25:38:93, 10:8f:fe:25:38:95, c0:e0:18:e5:e2:22, c0:e0:18:e5:e2:25, 10:8f:fe:25:38:92, 10:8f:fe:25:38:97, 18:f2:2c:b3:a0:08, c0:e0:18:e5:e2:20, c0:e0:18:e5:e2:21, c0:e0:18:e5:e2:24, c0:e0:18:e5:e2:27, 10:8f:fe:25:38:96, 10:8f:fe:25:38:91, c0:e0:18:e5:e2:26, 10:8f:fe:af:9f:d2, 10:8f:fe:af:9f:d6, 10:8f:fe:af:9f:d7, 58:c4:1e:79:ad:8d, e2:19:a7:d7:e8:c6]","[Xiaomi SU7_333639, Xiaomi SU7_333639, , HFB111213, DIRECT-Xiaomi SU7_776220, DIRECT-BMW 63108, WirelessSGF, DIRECT-BMW 63108, WirelessMobile, WirelessICC, IKEA WIFI, WirelessLocal_IO, WirelessDS, WirelessLocal, IKEA APP, WirelessLocal, IKEA APP, IKEA WIFI, WirelessSGF, WirelessLocal_IO, IKEA WIFI, WirelessDS, WirelessICC, WirelessDS, WirelessICC, IKEA APP, TP-LINK_A008, WirelessSGF, WirelessMobile, WirelessLocal_IO, IKEA APP, WirelessLocal, WirelessMobile, WirelessLocal, WirelessICC, WirelessLocal, IKEA APP, , vivo S30]","[-73, -74, -75, -77, -78, -82, -84, -84, -85, -85, -85, -85, -85, -85, -85, -86, -87, -87, -88, -88, -88, -88, -88, -88, -89, -89, -89, -89, -89, -89, -89, -90, -90, -90, -92, -92, -92, -94, -95]"
signal_20260108_1624.csv,"['Lte', 'Lte', 'Lte']","[309, 317, 309]","[-75, -89, -111]","[d0:aa:5f:eb:56:b3, 32:08:71:f8:99:53, c0:e0:18:e5:e2:10, c0:e0:18:e5:e2:12, c0:e0:18:e5:e2:13, c0:e0:18:e5:e2:14, c0:e0:18:e5:e2:16, c0:e0:18:e5:e2:17, c0:e0:18:e5:e2:11, c0:e0:18:e5:e2:15, 32:f7:8e:f8:99:53, 66:e2:20:a2:13:35, 18:f2:2c:b3:a0:08, 66:e2:20:a2:13:b4, 8c:53:c3:cf:4f:a2, 10:8f:fe:af:97:13, 10:8f:fe:af:97:16, 10:8f:fe:af:97:17, 10:8f:fe:af:97:14, 10:8f:fe:af:97:15, 8c:53:c3:cf:55:06, c0:e0:18:e5:e1:50, 8e:65:26:2e:6a:12, 10:8f:fe:af:91:51, c0:e0:18:e5:e1:53, c0:e0:18:e5:e1:57, c0:e0:18:e5:e1:56, c0:e0:18:e5:e1:54]","[, Xiaomi SU7_333639, WirelessSGF, WirelessICC, IKEA WIFI, WirelessLocal_IO, WirelessLocal, IKEA APP, WirelessMobile, WirelessDS, Xiaomi SU7_333639, DIRECT-BMW 63108, TP-LINK_A008, DIRECT-BMW 63108, HFB111213, IKEA WIFI, WirelessLocal, IKEA APP, WirelessLocal_IO, WirelessDS, Xiaomi_5505, WirelessSGF, Redmi Note 12 Turbo, WirelessMobile, IKEA WIFI, IKEA APP, WirelessLocal, WirelessLocal_IO]","[-76, -78, -80, -80, -80, -80, -80, -80, -81, -81, -82, -82, -82, -83, -84, -84, -85, -85, -85, -85, -88, -88, -90, -91, -91, -91, -91, -93]"
signal_20260108_1624.csv,"['Lte', 'Lte', 'Lte']","[309, 317, 309]","[-80, -92, -111]","[32:08:71:f8:99:53, c0:e0:18:e5:e2:11, c0:e0:18:e5:e2:12, c0:e0:18:e5:e2:13, c0:e0:18:e5:e2:15, c0:e0:18:e5:e2:10, c0:e0:18:e5:e2:14, c0:e0:18:e5:e2:16, c0:e0:18:e5:e2:17, 66:e2:20:a2:13:b4, d0:aa:5f:eb:56:b3, 10:8f:fe:af:97:13, 10:8f:fe:af:97:11, 8c:53:c3:cf:4f:a2, 10:8f:fe:af:97:16, 10:8f:fe:af:97:17, 10:8f:fe:af:97:14, 10:8f:fe:af:97:15, 32:f7:8e:f8:99:53, 10:8f:fe:af:97:12, 8c:53:c3:cf:55:06, 10:8f:fe:af:97:10, ac:64:cf:cb:26:10, 8e:65:26:2e:6a:12, c0:e0:18:e5:e1:53, c0:e0:18:e5:e1:50, c0:e0:18:e5:e1:54, c0:e0:18:e5:e1:55, 10:8f:fe:25:38:96, 10:8f:fe:af:91:52, c0:e0:18:e5:e1:56, c0:e0:18:e5:e1:51, 10:8f:fe:25:3a:92, 10:8f:fe:25:3a:93, 10:8f:fe:25:3a:94, 10:8f:fe:25:3a:97, 10:8f:fe:25:38:94, 10:8f:fe:af:91:53, 18:f2:2c:b3:a0:08, 10:8f:fe:25:3a:90, c0:e0:18:e5:e1:57, 10:8f:fe:af:91:56, c0:e0:18:e5:e1:52, 10:8f:fe:25:3a:95, 10:8f:fe:25:3a:91, 10:8f:fe:af:97:d7]","[Xiaomi SU7_333639, WirelessMobile, WirelessICC, IKEA WIFI, WirelessDS, WirelessSGF, WirelessLocal_IO, WirelessLocal, IKEA APP, DIRECT-BMW 63108, , IKEA WIFI, WirelessMobile, HFB111213, WirelessLocal, IKEA APP, WirelessLocal_IO, WirelessDS, Xiaomi SU7_333639, WirelessICC, Xiaomi_5505, WirelessSGF, FAW_VW003ac64cfcb2610, Redmi Note 12 Turbo, IKEA WIFI, WirelessSGF, WirelessLocal_IO, WirelessDS, WirelessLocal, WirelessICC, WirelessLocal, WirelessMobile, WirelessICC, IKEA WIFI, WirelessLocal_IO, IKEA APP, WirelessLocal_IO, IKEA WIFI, TP-LINK_A008, WirelessSGF, IKEA APP, WirelessLocal, WirelessICC, WirelessDS, WirelessMobile, IKEA APP]","[-74, -75, -75, -75, -75, -76, -76, -76, -76, -77, -82, -83, -84, -85, -85, -85, -85, -85, -86, -86, -87, -87, -88, -89, -89, -89, -89, -89, -90, -90, -90, -90, -90, -90, -90, -90, -91, -91, -91, -91, -91, -91, -91, -91, -92, -92]"
signal_20260108_1624.csv,"['Lte', 'Lte', 'Lte']","[309, 317, 309]","[-77, -88, -115]","[66:e2:20:a2:13:b4, 10:8f:fe:af:97:13, 10:8f:fe:af:97:16, 10:8f:fe:af:97:17, 10:8f:fe:af:97:14, 10:8f:fe:af:97:11, d0:aa:5f:eb:56:b3, 10:8f:fe:af:97:15, 10:8f:fe:af:97:10, 10:8f:fe:af:97:12, c0:e0:18:e5:e2:11, c0:e0:18:e5:e2:13, c0:e0:18:e5:e2:10, c0:e0:18:e5:e2:12, c0:e0:18:e5:e2:14, c0:e0:18:e5:e2:15, c0:e0:18:e5:e2:16, c0:e0:18:e5:e2:17, 32:08:71:f8:99:53, 32:f7:8e:f8:99:53, c0:e0:18:e5:e1:50, 10:8f:fe:25:3a:96, d2:ec:1f:64:0c:aa, 18:f2:2c:b3:a0:08, 10:8f:fe:25:3a:93, 10:8f:fe:af:97:23, 10:8f:fe:af:97:24, 10:8f:fe:af:97:26, 10:8f:fe:af:97:27, 8c:53:c3:cf:55:06, 10:8f:fe:25:3a:90, e2:19:a7:d7:e8:c6, 10:8f:fe:25:3a:92, 10:8f:fe:25:3a:97, 10:8f:fe:af:97:22, 10:8f:fe:af:97:25, 10:8f:fe:25:3a:91, 10:8f:fe:25:3a:95, 10:8f:fe:af:97:20, 10:8f:fe:af:97:21, 10:8f:fe:25:3a:94, 8e:65:26:2e:6a:12]","[DIRECT-BMW 63108, IKEA WIFI, WirelessLocal, IKEA APP, WirelessLocal_IO, WirelessMobile, , WirelessDS, WirelessSGF, WirelessICC, WirelessMobile, IKEA WIFI, WirelessSGF, WirelessICC, WirelessLocal_IO, WirelessDS, WirelessLocal, IKEA APP, Xiaomi SU7_333639, Xiaomi SU7_333639, WirelessSGF, WirelessLocal, DIRECT-Xiaomi SU7_776220, TP-LINK_A008, IKEA WIFI, IKEA WIFI, WirelessLocal_IO, WirelessLocal, IKEA APP, Xiaomi_5505, WirelessSGF, vivo S30, WirelessICC, IKEA APP, WirelessICC, WirelessDS, WirelessMobile, WirelessDS, WirelessSGF, WirelessMobile, WirelessLocal_IO, Redmi Note 12 Turbo]","[-75, -75, -75, -75, -75, -75, -76, -76, -76, -76, -80, -80, -81, -81, -81, -81, -81, -81, -82, -84, -86, -86, -89, -89, -89, -89, -89, -89, -89, -90, -90, -90, -90, -90, -90, -90, -91, -91, -91, -91, -92, -93]"
