Time,Cell_Type,Cell_ID,Cell_RSSI,WiFi_MAC,WiFi_ID,WiFi_RSSI
signal_20251120_1736.csv,"['Lte', 'Lte']","[473, 475]","[-79, -88]","[bc:9b:5e:fc:58:bf, 7c:b5:9b:17:0a:70, 24:69:68:f0:0d:88, c0:49:43:b2:a9:e0, c0:49:43:f1:59:82, bc:9b:5e:fc:58:c1, c0:49:43:f1:59:83, c0:49:43:b2:a9:e1, 44:a1:91:a5:79:d4, 44:a1:91:a5:79:d0, 44:a1:91:a5:79:d2, 44:a1:91:a5:79:d3, 44:a1:91:a5:79:d1, 38:a9:1c:2e:95:c5, 22:28:3e:14:fc:d4, 24:b8:da:7c:3a:60, 02:b5:53:61:39:60, 70:fd:45:71:14:4b, 5c:e8:83:7e:a4:b0, 5c:e8:83:7e:a4:b2, 5c:e8:83:7e:a4:b3, 5c:e8:83:7e:a4:b4, 5c:e8:83:7e:a4:b1, bc:13:a8:de:51:7f, 44:a1:91:a5:79:c4, 20:28:3e:04:fc:d4, ba:80:35:44:95:24, 20:08:89:91:d8:e9, b8:80:35:e4:95:24, 14:d8:64:ff:b4:e7, 6a:77:da:3b:c0:79, ce:29:bd:32:98:00, 20:08:89:91:d8:e8, 44:a1:91:a5:79:c0, cc:29:bd:e0:8c:ee, 68:77:da:0b:c0:79, 44:a1:91:a5:79:c1, ce:29:bd:b0:8c:ed, 5c:e8:83:7e:d2:d3, 24:b8:da:7c:3a:64, ce:29:bd:b0:8c:ee, a0:cf:f5:29:ec:7e, cc:29:bd:02:98:00, 5c:e8:83:7e:d2:d4, cc:c2:e0:69:b5:75, 68:4a:ae:9f:66:03]","[芒果Mango, , 艾力斯特, LTE-WiFi_5A1D, LTE-WiFi_5A1D, 芒果Mango, LTE-WiFi_5A1D_5G, LTE-WiFi_5A1D_5G, wirelesscs, Livat WiFi, camera, livestream, wirelessDS, tengye, iTV-3Y2r, CMCC-樊文花, 萌宝奇贝, hw_manage_1440, Livat WiFi, camera, livestream, wirelesscs, wirelessDS, PPM, wirelesscs, ChinaNet-3Y2r, , Mastet boxing-5G, LukFook Jewellery, bawangchaji_5G, , , Master boxing, Livat WiFi, 洗脸熊-5G, 十二集新中式养生-5G, wirelessDS, , livestream, CMCC-樊文花, , ChinaNet-n4T7, Master boxing, wirelesscs, ChinaNet-p3Uc, livestream]","[-62, -62, -63, -67, -68, -70, -71, -71, -72, -73, -73, -73, -75, -76, -76, -76, -78, -79, -80, -80, -80, -80, -80, -80, -80, -81, -81, -81, -81, -82, -82, -83, -83, -83, -83, -83, -83, -85, -85, -85, -85, -85, -87, -87, -88, -94]"
signal_20251120_1736.csv,"['Lte', 'Lte']","[473, 475]","[-76, -85]","[bc:9b:5e:fc:58:bf, 7c:b5:9b:17:0a:70, 24:69:68:f0:0d:88, c0:49:43:b2:a9:e0, bc:9b:5e:fc:58:c1, c0:49:43:b2:a9:e1, 38:a9:1c:2e:95:c5, 20:28:3e:04:fc:d4, 22:28:3e:14:fc:d4, c0:49:43:f1:59:83, 38:a9:1c:2e:95:c6, 70:fd:45:71:14:4b, 5c:e8:83:7e:a4:b0, 5c:e8:83:7e:a4:b2, 5c:e8:83:7e:a4:b3, 5c:e8:83:7e:a4:b4, 5c:e8:83:7e:a4:b1, 44:a1:91:a5:79:d0, 44:a1:91:a5:79:d2, 44:a1:91:a5:79:d3, 44:a1:91:a5:79:d1, 44:a1:91:a5:79:d4, 44:a1:91:a5:79:c4, 44:a1:91:a5:79:c0, 14:d8:64:ff:a9:df, c0:49:43:f1:59:82, 24:b8:da:7c:3a:64, 44:a1:91:a5:79:c3, 44:a1:91:a5:79:c2, 02:b5:53:61:39:60, 44:a1:91:a5:79:c1, 5c:e8:83:7e:a4:a4, 68:77:da:0b:c0:78, cc:29:bd:e0:8c:ee, 5c:e8:83:7e:a4:a0, 5c:e8:83:7e:a4:a2, ce:29:bd:b0:8f:4f, 24:37:c3:66:1e:a0, 5c:e8:83:7e:a4:a3, 24:21:5e:59:de:83, a2:cf:f5:19:ec:7e]","[芒果Mango, , 艾力斯特, LTE-WiFi_5A1D, 芒果Mango, LTE-WiFi_5A1D_5G, tengye, ChinaNet-3Y2r, iTV-3Y2r, LTE-WiFi_5A1D_5G, tengye_5G, hw_manage_1440, Livat WiFi, camera, livestream, wirelesscs, wirelessDS, Livat WiFi, camera, livestream, wirelessDS, wirelesscs, wirelesscs, Livat WiFi, bawangchaji, LTE-WiFi_5A1D, CMCC-樊文花, livestream, camera, 萌宝奇贝, wirelessDS, wirelesscs, 十二集新中式养生, 洗脸熊-5G, Livat WiFi, camera, , SZ034457, livestream, RTL8186-default, iTV-n4T7]","[-65, -65, -65, -66, -70, -70, -70, -70, -70, -71, -76, -76, -77, -77, -77, -77, -77, -77, -77, -77, -78, -78, -80, -81, -81, -82, -82, -82, -83, -83, -83, -85, -85, -87, -87, -87, -87, -87, -88, -90, -91]"
signal_20251120_1736.csv,"['Lte', 'Lte']","[473, 475]","[-77, -85]","[24:69:68:f0:0d:88, bc:9b:5e:fc:58:bf, 7c:b5:9b:17:0a:70, c0:49:43:b2:a9:e1, bc:9b:5e:fc:58:c1, c0:49:43:f1:59:83, 38:a9:1c:2e:95:c6, 20:28:3e:04:fc:d4, 22:28:3e:14:fc:d4, c0:49:43:b2:a9:e0, c0:49:43:f1:59:82, 44:a1:91:a5:79:d0, 44:a1:91:a5:79:d1, 44:a1:91:a5:79:d2, 44:a1:91:a5:79:d3, 44:a1:91:a5:79:d4, 5c:e8:83:7e:a4:b0, 5c:e8:83:7e:a4:b1, 5c:e8:83:7e:a4:b2, 5c:e8:83:7e:a4:b3, 5c:e8:83:7e:a4:b4, 70:fd:45:71:14:4b, 24:b8:da:7c:3a:64, 02:b5:53:61:39:60, 44:a1:91:a5:79:c0, ac:5d:5c:88:9a:ec, 5c:e8:83:7e:a4:a1, cc:29:bd:02:98:01, 5c:e8:83:7e:a4:a0, ce:29:bd:32:98:01, 10:9f:4f:bc:f6:3a, 44:a1:91:a5:79:c1, 5c:e8:83:7e:a4:a2, 10:9f:4f:bc:f6:3b, 16:9f:4f:bc:f6:3b, 44:a1:91:a5:79:c2, 5c:e8:83:7e:d2:d3, 5c:e8:83:7e:d2:d4, ba:80:35:44:95:24, 44:a1:91:a5:79:c3, 5c:e8:83:7e:d2:d0, 5c:e8:83:7e:d2:d1, 5c:e8:83:7e:d2:d2, ce:29:bd:b0:8c:ed, 24:21:5e:59:de:83, 80:76:c2:83:d7:b8, 44:df:65:9e:8d:57, f8:8c:21:25:2a:ce]","[艾力斯特, 芒果Mango, , LTE-WiFi_5A1D_5G, 芒果Mango, LTE-WiFi_5A1D_5G, tengye_5G, ChinaNet-3Y2r, iTV-3Y2r, LTE-WiFi_5A1D, LTE-WiFi_5A1D, Livat WiFi, wirelessDS, camera, livestream, wirelesscs, Livat WiFi, wirelessDS, camera, livestream, wirelesscs, hw_manage_1440, CMCC-樊文花, 萌宝奇贝, Livat WiFi, FAW_VW003ac5d5c889aec, wirelessDS, Mastet boxing-5G, Livat WiFi, , 修个机, wirelessDS, camera, 修个机-5G, , camera, livestream, wirelesscs, , livestream, Livat WiFi, wirelessDS, camera, , RTL8186-default, midea_ed_0775, MUJOSH, KKV]","[-58, -67, -67, -68, -73, -73, -73, -74, -74, -75, -75, -76, -76, -76, -76, -76, -79, -79, -80, -80, -80, -81, -82, -82, -84, -84, -84, -84, -85, -85, -85, -86, -86, -86, -86, -87, -87, -87, -88, -88, -88, -88, -88, -90, -90, -90, -90, -93]"
signal_20251120_1736.csv,"['Lte', 'Lte']","[473, 475]","[-69, -85]","[bc:9b:5e:fc:58:bf, 24:69:68:f0:0d:88, bc:9b:5e:fc:58:c1, c0:49:43:f1:59:82, c0:49:43:b2:a9:e1, 7c:b5:9b:17:0a:70, c2:49:43:b2:a9:e1, c0:49:43:f1:59:83, e8:9a:ff:06:a5:bb, 38:a9:1c:2e:95:c5, 44:a1:91:a5:79:d0, 44:a1:91:a5:79:d1, 38:a9:1c:2e:95:c6, 44:a1:91:a5:79:d2, 44:a1:91:a5:79:d4, 70:fd:45:71:14:4b, 5c:e8:83:7e:a4:b0, 5c:e8:83:7e:a4:b2, 5c:e8:83:7e:a4:b3, 5c:e8:83:7e:a4:b4, 5c:e8:83:7e:a4:b1, 44:a1:91:a5:79:d3, 22:28:3e:14:fc:d4, 3e:a9:1c:2e:95:c6, 20:28:3e:04:fc:d4, 24:21:5e:59:de:83, 22:08:89:b1:d8:e8, ce:29:bd:b0:8c:ed, 44:a1:91:a5:79:c1, 16:9f:4f:bc:f6:3b]","[芒果Mango, 艾力斯特, 芒果Mango, LTE-WiFi_5A1D, LTE-WiFi_5A1D_5G, , , LTE-WiFi_5A1D_5G, DIRECT-13-Android_81d3, tengye, Livat WiFi, wirelessDS, tengye_5G, camera, wirelesscs, hw_manage_1440, Livat WiFi, camera, livestream, wirelesscs, wirelessDS, livestream, iTV-3Y2r, , ChinaNet-3Y2r, RTL8186-default, , , wirelessDS, ]","[-63, -66, -68, -69, -69, -71, -71, -73, -73, -76, -78, -78, -79, -79, -79, -79, -80, -80, -80, -80, -80, -80, -81, -82, -83, -83, -83, -84, -90, -90]"
signal_20251120_1736.csv,['Lte'],[473],[-69],"[bc:9b:5e:fc:58:bf, 24:69:68:f0:0d:88, bc:9b:5e:fc:58:c1, c0:49:43:b2:a9:e0, c0:49:43:b2:a9:e1, c2:49:43:b2:a9:e1, c2:49:43:b1:59:83, 7c:b5:9b:17:0a:70, 38:a9:1c:2e:95:c5, c0:49:43:f1:59:83, ac:5d:5c:88:9a:ec, 20:28:3e:04:fc:d4, 24:b8:da:7c:3a:60, 22:28:3e:14:fc:d4, cc:29:bd:02:98:00, 6a:77:da:3b:c0:78, 38:a9:1c:2e:95:c6, 14:d8:64:ff:b4:e6, 70:fd:45:71:14:4b, 44:a1:91:a5:79:c0, 3e:a9:1c:2e:95:c6, 44:a1:91:a5:79:c2, 02:b5:53:61:39:60, 24:37:c3:66:1e:a0, 44:a1:91:a5:79:c3, 44:a1:91:a5:79:c1, bc:13:a8:de:51:7f, 24:21:5e:59:de:83, 9a:f9:cc:43:22:da]","[芒果Mango, 艾力斯特, 芒果Mango, LTE-WiFi_5A1D, LTE-WiFi_5A1D_5G, , , , tengye, LTE-WiFi_5A1D_5G, FAW_VW003ac5d5c889aec, ChinaNet-3Y2r, CMCC-樊文花, iTV-3Y2r, Master boxing, , tengye_5G, bawangchaji, hw_manage_1440, Livat WiFi, , camera, 萌宝奇贝, SZ034457, livestream, wirelessDS, PPM, RTL8186-default, IMmotorsCS]","[-60, -65, -69, -74, -76, -76, -76, -77, -77, -78, -79, -80, -80, -81, -82, -82, -83, -83, -84, -85, -85, -86, -86, -86, -86, -87, -88, -91, -91]"
signal_20251120_1736.csv,"['Lte', 'Lte']","[473, 322]","[-67, -84]","[24:69:68:f0:0d:88, 7c:b5:9b:17:0a:70, bc:9b:5e:fc:58:bf, bc:9b:5e:fc:58:c1, e8:9a:ff:06:a5:bb, 70:fd:45:71:14:4b, 44:a1:91:a5:79:d0, c0:49:43:b2:a9:e1, c0:49:43:f1:59:82, 38:a9:1c:2e:95:c5, 44:a1:91:a5:79:d1, 44:a1:91:a5:79:d2, 44:a1:91:a5:79:d3, 44:a1:91:a5:79:d4, 44:df:65:9e:8d:57, 5c:e8:83:7e:a4:b0, 5c:e8:83:7e:a4:b2, 5c:e8:83:7e:a4:b3, 5c:e8:83:7e:a4:b4, 5c:e8:83:7e:a4:b1, c0:49:43:b2:a9:e0, 20:28:3e:04:fc:d4, 22:28:3e:14:fc:d4, 44:a1:91:a5:79:c2, c2:49:43:b2:a9:e1, ce:29:bd:32:98:00, c0:49:43:f1:59:83, 38:a9:1c:2e:95:c6, c2:49:43:b1:59:83, 24:b8:da:7c:3a:60, 6a:77:da:3b:c0:78, 44:a1:91:a5:79:c3, 44:a1:91:a5:79:c4, aa:02:db:b7:55:b6, 24:21:5e:59:de:83, 10:9f:4f:bc:f6:3a, 44:a1:91:a5:79:c1, 20:08:89:91:d8:e8, 44:a1:91:a5:79:c0, 22:08:89:b1:d8:e8]","[艾力斯特, , 芒果Mango, 芒果Mango, DIRECT-13-Android_81d3, hw_manage_1440, Livat WiFi, LTE-WiFi_5A1D_5G, LTE-WiFi_5A1D, tengye, wirelessDS, camera, livestream, wirelesscs, MUJOSH, Livat WiFi, camera, livestream, wirelesscs, wirelessDS, LTE-WiFi_5A1D, ChinaNet-3Y2r, iTV-3Y2r, camera, , , LTE-WiFi_5A1D_5G, tengye_5G, , CMCC-樊文花, , livestream, wirelesscs, , RTL8186-default, 修个机, wirelessDS, Master boxing, Livat WiFi, ]","[-52, -64, -69, -71, -72, -77, -78, -79, -80, -81, -81, -81, -81, -81, -82, -83, -83, -83, -83, -83, -84, -84, -84, -84, -84, -84, -85, -85, -85, -85, -85, -87, -88, -88, -89, -89, -90, -90, -91, -91]"
signal_20251120_1736.csv,['Lte'],[473],[-65],"[24:69:68:f0:0d:88, 7c:b5:9b:17:0a:70, e8:9a:ff:06:a5:bb, bc:9b:5e:fc:58:bf, bc:9b:5e:fc:58:c1, c0:49:43:b2:a9:e1, 24:21:5e:59:de:83, 44:a1:91:a5:79:d2, 44:a1:91:a5:79:d4, 14:d8:64:ff:a9:df, 44:a1:91:a5:79:d0, 44:a1:91:a5:79:d1, 24:b8:da:7c:3a:60, c0:49:43:f1:59:82, 44:a1:91:a5:79:d3, 6a:77:da:3b:c0:78, 1a:3a:2f:c1:74:fd, 44:a1:91:a5:79:c4, c0:49:43:f1:59:83, 44:a1:91:a5:79:c0, c2:49:43:b1:59:83, 44:a1:91:a5:79:c1, 44:a1:91:a5:79:c3, 22:28:3e:14:fc:d4, a4:ba:70:d9:96:80]","[艾力斯特, , DIRECT-13-Android_81d3, 芒果Mango, 芒果Mango, LTE-WiFi_5A1D_5G, RTL8186-default, camera, wirelesscs, bawangchaji, Livat WiFi, wirelessDS, CMCC-樊文花, LTE-WiFi_5A1D, livestream, , A5L-23-B17C3, wirelesscs, LTE-WiFi_5A1D_5G, Livat WiFi, , wirelessDS, livestream, iTV-3Y2r, qyst]","[-58, -59, -68, -75, -80, -80, -80, -81, -81, -81, -82, -82, -82, -83, -83, -85, -85, -86, -87, -87, -87, -88, -89, -91, -92]"
signal_20251120_1736.csv,"['Lte', 'Lte']","[473, 475]","[-78, -93]","[bc:9b:5e:fc:58:bf, 7c:b5:9b:17:0a:70, 24:69:68:f0:0d:88, f0:b0:40:4c:2c:40, bc:9b:5e:fc:58:c1, c0:49:43:b2:a9:e0, c0:49:43:f1:59:83, c0:49:43:f1:59:82, 1a:3a:2f:c1:74:fd, ac:5d:5c:88:9a:ec, 44:df:65:9e:8d:57, 44:a1:91:a5:79:d0, 44:a1:91:a5:79:d3, 44:a1:91:a5:79:d1, 44:a1:91:a5:79:d2, 44:a1:91:a5:79:d4, 68:77:da:0b:c0:78, 5c:e8:83:7e:a4:b2, 24:21:5e:59:de:83, 5c:e8:83:7e:a4:b4, 9a:f9:cc:43:22:da, 68:4a:ae:9f:64:a4, 5c:e8:83:7e:a4:b3, 02:b5:53:61:39:60, 5c:e8:83:7e:a4:b0, bc:fa:b8:82:af:64, 5c:e8:83:7e:a4:b1, 70:fd:45:ea:09:64, 5c:e8:83:7e:a4:a4]","[芒果Mango, , 艾力斯特, 360行车记录仪M320Pro-3892, 芒果Mango, LTE-WiFi_5A1D, LTE-WiFi_5A1D_5G, LTE-WiFi_5A1D, A5L-23-B17C3, FAW_VW003ac5d5c889aec, MUJOSH, Livat WiFi, livestream, wirelessDS, camera, wirelesscs, 十二集新中式养生, camera, RTL8186-default, wirelesscs, IMmotorsCS, wirelesscs, livestream, 萌宝奇贝, Livat WiFi, DVR-CAR-af64, wirelessDS, wirelesscs, wirelesscs]","[-61, -68, -68, -73, -77, -77, -80, -81, -81, -83, -83, -85, -85, -86, -86, -86, -87, -88, -88, -89, -89, -89, -90, -90, -91, -91, -92, -93, -96]"
signal_20251120_1736.csv,"['Lte', 'Lte']","[473, 322]","[-79, -94]","[bc:9b:5e:fc:58:bf, 24:69:68:f0:0d:88, c0:49:43:b2:a9:e0, 7c:b5:9b:17:0a:70, f0:b0:40:4c:2c:40, bc:9b:5e:fc:58:c1, 1a:3a:2f:c1:74:fd, 44:df:65:9e:8d:57, c0:49:43:f1:59:82, 44:a1:91:a5:79:d0, 22:28:3e:14:fc:d4, 24:37:c3:66:1e:a0, 44:a1:91:a5:79:c1, 44:a1:91:a5:79:c3, 5c:e8:83:7e:a4:b3, 5c:e8:83:7e:a4:b4, 44:a1:91:a5:79:c2, 24:21:5e:59:de:83, 6a:77:da:3b:c0:78, 9a:f9:cc:43:22:da, f8:56:c3:57:36:c5, 44:a1:91:a5:79:c0, ce:29:bd:b0:8c:ed]","[芒果Mango, 艾力斯特, LTE-WiFi_5A1D, , 360行车记录仪M320Pro-3892, 芒果Mango, A5L-23-B17C3, MUJOSH, LTE-WiFi_5A1D, Livat WiFi, iTV-3Y2r, SZ034457, wirelessDS, livestream, livestream, wirelesscs, camera, RTL8186-default, , IMmotorsCS, ChinaNet-p4Ec, Livat WiFi, ]","[-66, -67, -68, -73, -75, -76, -77, -80, -84, -86, -86, -86, -89, -89, -91, -91, -91, -91, -91, -91, -91, -92, -92]"
signal_20251120_1736.csv,"['Lte', 'Lte']","[473, 322]","[-76, -94]","[bc:9b:5e:fc:58:bf, 24:69:68:f0:0d:88, 7c:b5:9b:17:0a:70, bc:9b:5e:fc:58:c1, 1a:3a:2f:c1:74:fd, f0:b0:40:4c:2c:40, e8:9a:ff:06:a5:bb, c0:49:43:b2:a9:e0, 44:df:65:9e:8d:57, c0:49:43:b2:a9:e1, ac:5d:5c:88:9a:ec, 9a:f9:cc:43:22:da, 44:a1:91:a5:79:d0, 44:a1:91:a5:79:d1, 44:a1:91:a5:79:d2, 44:a1:91:a5:79:d4, 5c:e8:83:7e:a4:b2, 44:a1:91:a5:79:d3, 5c:e8:83:7e:a4:b3, 5c:e8:83:7e:a4:b1, 9a:f9:cc:43:22:0b, 5c:e8:83:7e:a4:b0, 5c:e8:83:7e:a4:b4, 44:a1:91:a5:79:c4, 02:b5:53:61:39:60]","[芒果Mango, 艾力斯特, , 芒果Mango, A5L-23-B17C3, 360行车记录仪M320Pro-3892, DIRECT-13-Android_81d3, LTE-WiFi_5A1D, MUJOSH, LTE-WiFi_5A1D_5G, FAW_VW003ac5d5c889aec, IMmotorsCS, Livat WiFi, wirelessDS, camera, wirelesscs, camera, livestream, livestream, wirelessDS, IMmotorsCS, Livat WiFi, wirelesscs, wirelesscs, 萌宝奇贝]","[-71, -71, -72, -77, -77, -77, -78, -81, -81, -82, -82, -84, -86, -86, -86, -86, -87, -87, -88, -88, -88, -89, -89, -92, -93]"
signal_20251120_1736.csv,['Lte'],[473],[-81],"[7c:b5:9b:17:0a:70, ac:5d:5c:88:9a:ec, 24:69:68:f0:0d:88, bc:9b:5e:fc:58:bf, e8:9a:ff:06:a5:bb, 1a:3a:2f:c1:74:fd, 94:e0:d6:03:51:8c, c0:49:43:b2:a9:e1, 44:df:65:9e:8d:57, 44:a1:91:a5:79:d1, 44:a1:91:a5:79:d4, 44:a1:91:a5:79:d0, 44:a1:91:a5:79:d2, bc:9b:5e:fc:58:c1, 44:a1:91:a5:79:d3, c0:49:43:f1:59:82, 70:fd:45:71:14:4b, 9a:f9:cc:43:22:da, 68:4a:ae:9f:64:a2, 2a:62:f1:e4:19:6d, 68:4a:ae:9f:64:a3, 20:08:89:91:d8:e8, 68:4a:ae:9f:64:a0, 68:4a:ae:9f:64:a1]","[, FAW_VW003ac5d5c889aec, 艾力斯特, 芒果Mango, DIRECT-13-Android_81d3, A5L-23-B17C3, StarTimesDVR_94e0d603518c, LTE-WiFi_5A1D_5G, MUJOSH, wirelessDS, wirelesscs, Livat WiFi, camera, 芒果Mango, livestream, LTE-WiFi_5A1D, hw_manage_1440, IMmotorsCS, camera, yu7, livestream, Master boxing, Livat WiFi, wirelessDS]","[-70, -70, -71, -75, -77, -77, -79, -83, -83, -84, -84, -85, -85, -86, -86, -87, -87, -89, -90, -91, -91, -93, -93, -93]"
signal_20251120_1736.csv,['Lte'],[473],[-78],"[ac:5d:5c:88:9a:ec, 7c:b5:9b:17:0a:70, 1a:3a:2f:c1:74:fd, 24:69:68:f0:0d:88, bc:9b:5e:fc:58:bf, a8:02:db:97:55:b6, 94:e0:d6:03:51:8c, bc:9b:5e:fc:58:c1, c0:49:43:b2:a9:e0, aa:02:db:b7:55:b6, 68:4a:ae:9f:64:a4, 68:4a:ae:9f:64:a3, 44:a1:91:a5:79:d2, 68:4a:ae:9f:64:a2, 9a:f9:cc:43:22:0b, ee:a7:ad:83:9a:5f, 24:21:5e:59:de:83, 20:28:3e:04:fc:d4, ce:29:bd:b0:8f:4f, 9a:f9:cc:43:22:aa, 14:51:7e:5e:26:f9]","[FAW_VW003ac5d5c889aec, , A5L-23-B17C3, 艾力斯特, 芒果Mango, HOPESHOW, StarTimesDVR_94e0d603518c, 芒果Mango, LTE-WiFi_5A1D, , wirelesscs, livestream, camera, camera, IMmotorsCS, 0李勇0的AIOS_3232, RTL8186-default, ChinaNet-3Y2r, , IMmotorsCS, ]","[-70, -73, -74, -75, -78, -79, -81, -83, -83, -84, -86, -87, -88, -88, -89, -89, -91, -91, -93, -94, -95]"
signal_20251120_1736.csv,['Lte'],[473],[-82],"[ac:5d:5c:88:9a:ec, 7c:b5:9b:17:0a:70, 1a:3a:2f:c1:74:fd, f0:b0:40:4c:2c:40, 24:69:68:f0:0d:88, e8:9a:ff:06:a5:bb, bc:9b:5e:fc:58:bf, 94:e0:d6:03:51:8c, 9a:f9:cc:43:22:da, 9a:f9:cc:43:22:0b, 44:a1:91:a5:79:d0, a8:02:db:97:55:b6, c2:49:43:b2:a9:e1, 68:4a:ae:9f:64:a1, 68:4a:ae:9f:64:a2, c0:49:43:f1:59:82, 14:51:7e:5e:26:f9]","[FAW_VW003ac5d5c889aec, , A5L-23-B17C3, 360行车记录仪M320Pro-3892, 艾力斯特, DIRECT-13-Android_81d3, 芒果Mango, StarTimesDVR_94e0d603518c, IMmotorsCS, IMmotorsCS, Livat WiFi, HOPESHOW, , wirelessDS, camera, LTE-WiFi_5A1D, ]","[-65, -71, -75, -75, -76, -78, -79, -80, -82, -84, -86, -86, -87, -88, -88, -89, -93]"
signal_20251120_1736.csv,['Lte'],[473],[-78],"[ac:5d:5c:88:9a:ec, 7c:b5:9b:17:0a:70, 24:69:68:f0:0d:88, f0:b0:40:4c:2c:40, 1a:3a:2f:c1:74:fd, c0:49:43:f1:59:83, c2:49:43:b2:a9:e1, c0:49:43:b2:a9:e1, c2:49:43:b1:59:83, c0:49:43:b2:a9:e0, 9a:f9:cc:43:22:da, 9a:f9:cc:43:22:0b, 94:e0:d6:03:51:8c]","[FAW_VW003ac5d5c889aec, , 艾力斯特, 360行车记录仪M320Pro-3892, A5L-23-B17C3, LTE-WiFi_5A1D_5G, , LTE-WiFi_5A1D_5G, , LTE-WiFi_5A1D, IMmotorsCS, IMmotorsCS, StarTimesDVR_94e0d603518c]","[-62, -74, -77, -78, -84, -87, -88, -89, -89, -90, -90, -91, -91]"
signal_20251120_1736.csv,['Lte'],[473],[-72],"[ac:5d:5c:88:9a:ec, f0:b0:40:4c:2c:40, 14:51:7e:5e:26:f9, 14:51:7e:5e:26:f7, e8:9a:ff:06:a5:bb, 24:69:68:f0:0d:88, 7c:b5:9b:17:0a:70, 1a:3a:2f:c1:74:fd, 14:51:7e:5e:2d:4b, 9a:f9:cc:43:22:0b, 24:21:5e:59:de:83, 14:51:7e:5e:2d:4d]","[FAW_VW003ac5d5c889aec, 360行车记录仪M320Pro-3892, , NIO-Space-2.4G, DIRECT-13-Android_81d3, 艾力斯特, , A5L-23-B17C3, NIO-Space-2.4G, IMmotorsCS, RTL8186-default, ]","[-71, -79, -79, -79, -80, -83, -85, -86, -86, -89, -91, -91]"
signal_20251120_1736.csv,"['Lte', 'Lte']","[473, 474]","[-74, -93]","[f0:b0:40:4c:2c:40, ac:5d:5c:88:9a:ec, 7c:b5:9b:17:0a:70, 24:69:68:f0:0d:88, 14:51:7e:5e:2d:4d, 14:51:7e:5e:2d:4b, fa:64:b8:2d:04:26, d0:c5:d3:32:e5:47, bc:fa:b8:82:af:64, 34:75:63:5e:fa:84, 2a:62:f1:e4:19:6d, 24:21:5e:59:de:83, 14:51:7e:5e:26:f7, 1a:3a:2f:c1:74:fd]","[360行车记录仪M320Pro-3892, FAW_VW003ac5d5c889aec, , 艾力斯特, , NIO-Space-2.4G, SSID_GUEST, VOLVO_DVR IV_E547, DVR-CAR-af64, DVR-fa84, yu7, RTL8186-default, NIO-Space-2.4G, A5L-23-B17C3]","[-75, -77, -81, -82, -88, -89, -89, -90, -90, -91, -92, -93, -93, -94]"
signal_20251120_1736.csv,"['Lte', 'Lte']","[473, 474]","[-75, -92]","[14:51:7e:5e:26:f9, 14:51:7e:5e:26:f7, ac:5d:5c:88:9a:ec, 7c:b5:9b:17:0a:70, f0:b0:40:4c:2c:40, 14:51:7e:5e:2d:4d, 14:51:7e:5e:2d:4b, 9a:f9:cc:43:22:0b, 7c:39:85:6e:f3:b3, 7c:39:85:6e:f3:b1, 9a:f9:cc:43:22:da, d0:c5:d3:32:e5:47, 34:75:63:5e:fa:84, bc:fa:b8:82:af:64, 68:4a:ae:9f:62:e2, 2a:c8:7c:11:d3:93]","[, NIO-Space-2.4G, FAW_VW003ac5d5c889aec, , 360行车记录仪M320Pro-3892, , NIO-Space-2.4G, IMmotorsCS, Cashier, HUAWEI EA, IMmotorsCS, VOLVO_DVR IV_E547, DVR-fa84, DVR-CAR-af64, camera, iTV-5SWf]","[-73, -73, -76, -77, -77, -82, -83, -88, -88, -89, -92, -92, -92, -93, -94, -95]"
signal_20251120_1736.csv,"['Lte', 'Lte', 'Lte']","[473, 474, 322]","[-78, -98, -99]","[7c:b5:9b:17:0a:70, f0:b0:40:4c:2c:40, 14:51:7e:5e:26:f7, ac:5d:5c:88:9a:ec, 14:51:7e:5e:26:f9, e8:9a:ff:06:a5:bb, 14:51:7e:5e:2d:4d, 70:fd:45:4b:1c:13, 70:fd:45:4b:1c:14, 70:fd:45:4b:1c:10, 70:fd:45:4b:1c:11, 70:fd:45:4b:1c:12, 14:51:7e:5e:2d:4b, d0:c5:d3:32:e5:47, bc:fa:b8:82:af:64, 1a:3a:2f:c1:74:fd, 9a:f9:cc:43:22:0b, 34:75:63:5e:fa:84, 86:65:69:1e:d7:4e, 44:df:65:9e:8d:57]","[, 360行车记录仪M320Pro-3892, NIO-Space-2.4G, FAW_VW003ac5d5c889aec, , DIRECT-13-Android_81d3, , livestream, wirelesscs, Livat WiFi, wirelessDS, camera, NIO-Space-2.4G, VOLVO_DVR IV_E547, DVR-CAR-af64, A5L-23-B17C3, IMmotorsCS, DVR-fa84, 仲夏物语, MUJOSH]","[-77, -77, -80, -83, -83, -86, -86, -86, -86, -87, -87, -87, -90, -90, -90, -91, -91, -92, -93, -95]"
signal_20251120_1736.csv,['Lte'],[473],[-84],"[f0:b0:40:4c:2c:40, 7c:b5:9b:17:0a:70, ac:5d:5c:88:9a:ec, 7c:39:85:6e:f5:73, d0:c5:d3:32:e5:47, 86:65:69:1e:d7:4e, 70:fd:45:4b:1c:10, 7c:39:85:6e:f5:71, 14:51:7e:5e:26:f9, 14:51:7e:5e:2d:4b, 14:51:7e:5e:26:f7, 4c:c6:4c:84:1b:05, 24:21:5e:59:de:83, 9a:f9:cc:43:22:da, 42:70:b7:6c:d7:d1]","[360行车记录仪M320Pro-3892, , FAW_VW003ac5d5c889aec, Cashier, VOLVO_DVR IV_E547, 仲夏物语, Livat WiFi, HUAWEI EA, , NIO-Space-2.4G, NIO-Space-2.4G, dreame, RTL8186-default, IMmotorsCS, HUAWEI-1GV7VTBF]","[-78, -82, -84, -86, -87, -87, -88, -88, -89, -91, -91, -93, -94, -94, -94]"
signal_20251120_1736.csv,"['Lte', 'Lte']","[473, 474]","[-82, -100]","[f0:b0:40:4c:2c:40, 7c:b5:9b:17:0a:70, 28:f5:2b:fb:e2:f6, ac:5d:5c:88:9a:ec, d0:c5:d3:32:e5:47, e8:9a:ff:06:a5:bb, 14:51:7e:5e:26:f7, 14:51:7e:5e:26:f9, 70:fd:45:4b:1c:10, 4c:c6:4c:84:1b:05, f8:64:b8:7d:04:26, 14:51:7e:5e:2d:4b, 14:51:7e:5e:2d:4d]","[360行车记录仪M320Pro-3892, , BYD_DVR_E2F6, FAW_VW003ac5d5c889aec, VOLVO_DVR IV_E547, DIRECT-13-Android_81d3, NIO-Space-2.4G, , Livat WiFi, dreame, Purcotton, NIO-Space-2.4G, ]","[-74, -80, -81, -85, -85, -86, -86, -87, -89, -90, -90, -91, -94]"
signal_20251120_1736.csv,"['Lte', 'Lte']","[473, 474]","[-83, -99]","[f0:b0:40:4c:2c:40, 7c:b5:9b:17:0a:70, e8:9a:ff:06:a5:bb, ac:5d:5c:88:9a:ec, 14:51:7e:5e:26:f9, 70:fd:45:4b:1c:12, 14:51:7e:5e:26:f7, 70:fd:45:4b:1c:11, 70:fd:45:4b:1c:13, 70:fd:45:4b:1c:14, 70:fd:45:4b:1c:10, 14:51:7e:5e:2d:4b, bc:fa:b8:82:af:64, f4:2a:7d:19:1a:e7, 14:51:7e:5e:2d:4d, 78:a1:3e:fa:28:e8]","[360行车记录仪M320Pro-3892, , DIRECT-13-Android_81d3, FAW_VW003ac5d5c889aec, , camera, NIO-Space-2.4G, wirelessDS, livestream, wirelesscs, Livat WiFi, NIO-Space-2.4G, DVR-CAR-af64, POPMART, , XP-OFFICE]","[-76, -80, -81, -83, -83, -86, -87, -87, -87, -87, -89, -91, -91, -91, -92, -93]"
signal_20251120_1736.csv,"['Lte', 'Lte']","[473, 474]","[-79, -89]","[28:f5:2b:fb:e2:f6, f0:b0:40:4c:2c:40, 7c:b5:9b:17:0a:70, d0:c5:d3:32:e5:47, 70:fd:45:4b:1c:04, 78:a1:3e:fa:28:e8, 70:fd:45:4b:1c:10, 70:fd:45:4b:1c:12, 70:fd:45:4b:1c:14, 70:fd:45:4b:1c:11, 70:fd:45:4b:1c:13, 14:51:7e:5e:26:f9, 2a:62:f1:e4:19:6d, 24:21:5e:59:de:83, 3c:67:ff:93:b6:3a]","[BYD_DVR_E2F6, 360行车记录仪M320Pro-3892, , VOLVO_DVR IV_E547, wirelesscs, XP-OFFICE, Livat WiFi, camera, wirelesscs, wirelessDS, livestream, , yu7, RTL8186-default, MIFI-B63A]","[-69, -74, -82, -82, -85, -86, -88, -88, -88, -89, -89, -90, -92, -93, -94]"
signal_20251120_1736.csv,"['Lte', 'Lte']","[473, 474]","[-84, -91]","[28:f5:2b:fb:e2:f6, f4:2a:7d:19:1a:e7, 14:51:7e:5e:2d:4d, 70:fd:45:4b:1c:10, 70:fd:45:4b:1c:01, 70:fd:45:4b:1c:03, 70:fd:45:4b:1c:04, 7c:b5:9b:17:0a:70, 24:69:68:f0:0d:88, 34:75:63:5e:fa:84, 14:51:7e:5e:26:f9, 70:fd:45:4b:1c:02, 70:fd:45:4a:d5:20, d0:c5:d3:32:e5:47]","[BYD_DVR_E2F6, POPMART, , Livat WiFi, wirelessDS, livestream, wirelesscs, , 艾力斯特, DVR-fa84, , camera, Livat WiFi, VOLVO_DVR IV_E547]","[-70, -83, -84, -84, -84, -84, -85, -87, -87, -87, -88, -88, -92, -93]"
signal_20251120_1736.csv,"['Lte', 'Lte']","[473, 474]","[-87, -87]","[28:f5:2b:fb:e2:f6, 70:fd:45:4b:1c:11, 70:fd:45:4b:1c:12, 70:fd:45:4b:1c:13, 70:fd:45:4b:1c:10, 70:fd:45:4b:1c:14, 14:51:7e:5e:26:f9, 24:69:68:f0:0d:88, 68:4a:ae:9f:62:e3, 68:4a:ae:9f:62:e4, 14:51:7e:5e:2d:4b, 78:a1:3e:fa:28:e8, 14:51:7e:5e:2d:4d, 4c:c6:4c:84:1b:05, 9a:f9:cc:43:22:aa]","[BYD_DVR_E2F6, wirelessDS, camera, livestream, Livat WiFi, wirelesscs, , 艾力斯特, livestream, wirelesscs, NIO-Space-2.4G, XP-OFFICE, , dreame, IMmotorsCS]","[-79, -84, -84, -84, -85, -85, -90, -90, -90, -90, -91, -92, -93, -93, -93]"
signal_20251120_1736.csv,"['Lte', 'Lte', 'Lte', 'Lte']","[473, 474, 172, 171]","[-90, -85, -108, -124]","[28:f5:2b:fb:e2:f6, 70:fd:45:4b:1c:10, 70:fd:45:4b:1c:12, 70:fd:45:4b:1c:14, 70:fd:45:4b:1c:11, 70:fd:45:4b:1c:13, f4:2a:7d:19:1a:e7, 34:75:63:5e:fa:84, 7c:b5:9b:17:0a:70, 14:51:7e:5e:26:f7, 14:51:7e:5e:2d:4b, 24:69:68:f0:0d:88]","[BYD_DVR_E2F6, Livat WiFi, camera, wirelesscs, wirelessDS, livestream, POPMART, DVR-fa84, , NIO-Space-2.4G, NIO-Space-2.4G, 艾力斯特]","[-78, -80, -82, -82, -83, -83, -83, -83, -91, -91, -92, -92]"
signal_20251120_1736.csv,"['Lte', 'Lte', 'Lte', 'Lte', 'Lte']","[473, 474, 172, 171, 178]","[-91, -83, -105, -119, -119]","[28:f5:2b:fb:e2:f6, 70:fd:45:4b:1c:10, 70:fd:45:4b:1c:11, 70:fd:45:4b:1c:12, 70:fd:45:4b:1c:13, 70:fd:45:4b:1c:14, fa:64:b8:2d:04:26, f8:64:b8:7d:04:26, 14:51:7e:5e:2d:4d, 14:51:7e:5e:26:f7, 0a:42:d3:36:22:43, 14:51:7e:5e:26:f9, 78:a1:3e:fa:28:e8, 70:fd:45:4a:d5:21, 9a:f9:cc:43:22:aa, 9a:f9:cc:43:22:0b]","[BYD_DVR_E2F6, Livat WiFi, wirelessDS, camera, livestream, wirelesscs, SSID_GUEST, Purcotton, , NIO-Space-2.4G, lixiang-guest, , XP-OFFICE, wirelessDS, IMmotorsCS, IMmotorsCS]","[-77, -79, -79, -79, -79, -79, -82, -83, -84, -84, -84, -88, -90, -92, -93, -93]"
signal_20251120_1736.csv,"['Lte', 'Lte', 'Lte', 'Lte', 'Lte']","[473, 474, 322, 172, 171]","[-92, -85, -101, -106, -120]","[28:f5:2b:fb:e2:f6, 70:fd:45:4b:1c:10, 70:fd:45:4b:1c:11, 70:fd:45:4b:1c:13, 70:fd:45:4b:1c:14, 14:51:7e:5e:26:f9, 70:fd:45:4b:1c:12, f4:2a:7d:19:1a:e7, 14:51:7e:5e:26:f7, 0e:42:d3:36:22:43, 48:5c:2c:b0:d6:4e]","[BYD_DVR_E2F6, Livat WiFi, wirelessDS, livestream, wirelesscs, , camera, POPMART, NIO-Space-2.4G, lixiang-person, HIKVISION-K2+-d64e]","[-75, -84, -84, -84, -84, -85, -85, -85, -87, -89, -92]"
signal_20251120_1736.csv,"['Lte', 'Lte', 'Lte', 'Lte']","[473, 474, 172, 171]","[-92, -86, -102, -121]","[28:f5:2b:fb:e2:f6, 70:fd:45:4b:1c:10, 70:fd:45:4b:1c:04, 70:fd:45:4b:1c:11, 70:fd:45:4b:1c:12, 70:fd:45:4b:1c:13, 70:fd:45:4b:1c:14, fa:64:b8:2d:04:26, 14:51:7e:5e:2d:4b, 14:51:7e:5e:26:f7, 0a:42:d3:36:22:43, 70:fd:45:4a:d5:24, 14:51:7e:5e:2d:4d, bc:9d:42:1f:2c:d2, 70:fd:45:4a:d5:21, 0e:42:d3:36:22:43, fa:6b:14:77:49:97, 14:51:7e:5e:26:f9, 70:fd:45:4a:d5:20, b0:b1:94:cc:ad:85]","[BYD_DVR_E2F6, Livat WiFi, wirelesscs, wirelessDS, camera, livestream, wirelesscs, SSID_GUEST, NIO-Space-2.4G, NIO-Space-2.4G, lixiang-guest, wirelesscs, , , wirelessDS, lixiang-person, DIRECT-y1-Android_499b, , Livat WiFi, ChinaNet-HgNM]","[-68, -77, -81, -82, -82, -82, -82, -82, -85, -86, -86, -86, -87, -87, -88, -88, -88, -91, -91, -93]"
signal_20251120_1736.csv,"['Lte', 'Lte', 'Lte', 'Lte', 'Lte']","[473, 474, 322, 172, 171]","[-89, -85, -102, -99, -116]","[70:fd:45:4b:1c:10, 70:fd:45:4b:1c:11, 70:fd:45:4b:1c:12, 70:fd:45:4b:1c:13, 70:fd:45:4b:1c:14, 28:f5:2b:fb:e2:f6, 14:51:7e:5e:2d:4d, 9a:f9:cc:43:22:aa, f8:64:b8:7d:04:26, f4:2a:7d:19:1a:e7, 0a:42:d3:36:22:43, 14:51:7e:5e:26:f9, 14:51:7e:5e:2d:4b, 14:51:7e:5e:26:f7, 0a:42:d3:36:20:83]","[Livat WiFi, wirelessDS, camera, livestream, wirelesscs, BYD_DVR_E2F6, , IMmotorsCS, Purcotton, POPMART, lixiang-guest, , NIO-Space-2.4G, NIO-Space-2.4G, lixiang-guest]","[-78, -78, -78, -78, -78, -79, -81, -82, -82, -83, -83, -86, -90, -91, -93]"
