Time,Cell_Type,Cell_ID,Cell_RSSI,WiFi_MAC,WiFi_ID,WiFi_RSSI
signal_20251120_1711.csv,"['Lte', 'Lte']","[473, 475]","[-77, -89]","[14:c9:cf:41:90:66, ac:5d:5c:c3:e3:da, c0:49:43:f1:59:82, c0:49:43:b2:a9:e0, 24:69:68:f0:0d:88, 1e:e1:92:de:99:55, c0:49:43:b2:a9:e1, bc:9b:5e:fc:58:bf, c0:49:43:f1:59:83, 38:a9:1c:2e:95:c5, 7c:b5:9b:17:0a:70, bc:9b:5e:fc:58:c1, 24:b8:da:7c:3a:60, 22:28:3e:14:fc:d4, 20:28:3e:04:fc:d4, 1e:e1:92:de:99:d4, 44:a1:91:a5:79:d0, 44:a1:91:a5:79:d1, 44:a1:91:a5:79:d2, 44:a1:91:a5:79:d4, 44:a1:91:a5:79:d3, 5c:e8:83:7e:a4:b3, 70:fd:45:71:14:4b, 5c:e8:83:7e:a4:b0, 38:a9:1c:2e:95:c6, 02:b5:53:61:39:60, 5c:e8:83:7e:a4:b1, 5c:e8:83:7e:a4:b4, 3e:a9:1c:2e:95:c6, 5c:e8:83:7e:a4:b2, cc:29:bd:02:98:01, ce:29:bd:b0:8c:ee, ce:29:bd:32:98:01, cc:29:bd:e0:8c:ee, cc:c2:e0:69:b5:75, ba:80:35:44:95:24, b8:80:35:e4:95:24, 5c:e8:83:7e:d2:d3]","[F888_9066, GMBe3da, LTE-WiFi_5A1D, LTE-WiFi_5A1D, 艾力斯特, DIRECT-BMW 54068, LTE-WiFi_5A1D_5G, 芒果Mango, LTE-WiFi_5A1D_5G, tengye, , 芒果Mango, CMCC-樊文花, iTV-3Y2r, ChinaNet-3Y2r, DIRECT-BMW 54068, Livat WiFi, wirelessDS, camera, wirelesscs, livestream, livestream, hw_manage_1440, Livat WiFi, tengye_5G, 萌宝奇贝, wirelessDS, wirelesscs, , camera, Mastet boxing-5G, , , 洗脸熊-5G, ChinaNet-p3Uc, , LukFook Jewellery, livestream]","[-56, -65, -66, -66, -67, -68, -69, -70, -71, -71, -72, -73, -74, -76, -76, -77, -79, -79, -79, -79, -80, -80, -80, -81, -81, -81, -82, -82, -82, -84, -85, -85, -86, -87, -87, -88, -88, -90]"
signal_20251120_1711.csv,"['Lte', 'Lte']","[473, 475]","[-84, -86]","[24:69:68:f0:0d:88, ac:5d:5c:c3:e3:da, 7c:b5:9b:17:0a:70, c0:49:43:b2:a9:e1, c2:49:43:b2:a9:e1, c0:49:43:f1:59:82, c0:49:43:f1:59:83, bc:9b:5e:fc:58:bf, c2:49:43:b1:59:83, bc:9b:5e:fc:58:c1, 5c:e8:83:7e:a4:b1, 14:c9:cf:41:90:66, 70:fd:45:71:14:4b, 5c:e8:83:7e:a4:b0, 5c:e8:83:7e:a4:b2, 5c:e8:83:7e:a4:b4, 38:a9:1c:2e:95:c6, 44:a1:91:a5:79:d2, 5c:e8:83:7e:a4:b3, ac:5d:5c:88:9a:ec, 44:a1:91:a5:79:d3, 44:a1:91:a5:79:d4, 44:a1:91:a5:79:d0, 44:a1:91:a5:79:d1, 24:b8:da:7c:3a:60, 44:a1:91:a5:79:c0, cc:29:bd:e0:8c:ed, cc:29:bd:02:98:01, ce:29:bd:32:98:01, 68:4a:ae:9f:7e:84, 1e:e1:92:de:99:d4, ee:81:c7:d3:48:80, 24:21:5e:59:de:83, 10:9f:4f:bc:f6:3b, 16:9f:4f:bc:f6:3b, 6a:77:da:3b:c0:79, ba:80:35:44:95:24, 68:4a:ae:9f:7e:80, b8:80:35:e4:95:24]","[艾力斯特, GMBe3da, , LTE-WiFi_5A1D_5G, , LTE-WiFi_5A1D, LTE-WiFi_5A1D_5G, 芒果Mango, , 芒果Mango, wirelessDS, F888_9066, hw_manage_1440, Livat WiFi, camera, wirelesscs, tengye_5G, camera, livestream, FAW_VW003ac5d5c889aec, livestream, wirelesscs, Livat WiFi, wirelessDS, CMCC-樊文花, Livat WiFi, 洗脸熊, Mastet boxing-5G, , wirelesscs, DIRECT-BMW 54068, Xiaomi YU7_282555, RTL8186-default, 修个机-5G, , , , Livat WiFi, LukFook Jewellery]","[-58, -61, -67, -68, -68, -69, -70, -70, -71, -79, -79, -79, -79, -80, -80, -80, -80, -81, -81, -81, -82, -82, -83, -83, -84, -84, -85, -86, -86, -86, -87, -87, -88, -89, -89, -89, -93, -93, -94]"
signal_20251120_1711.csv,"['Lte', 'Lte']","[473, 475]","[-75, -88]","[ac:5d:5c:c3:e3:da, 24:69:68:f0:0d:88, bc:9b:5e:fc:58:c1, 7c:b5:9b:17:0a:70, c0:49:43:b2:a9:e1, c0:49:43:f1:59:82, c0:49:43:b2:a9:e0, c0:49:43:f1:59:83, 38:a9:1c:2e:95:c5, 5c:e8:83:7e:a4:b1, 44:a1:91:a5:79:d1, 44:a1:91:a5:79:d3, 5c:e8:83:7e:a4:b0, 5c:e8:83:7e:a4:b2, 5c:e8:83:7e:a4:b3, 5c:e8:83:7e:a4:b4, 44:a1:91:a5:79:d0, 44:a1:91:a5:79:d2, 44:a1:91:a5:79:d4, 38:a9:1c:2e:95:c6, 14:d8:64:ff:b4:e6, 44:df:65:9e:8d:57, 22:08:89:b1:d8:e8, 3e:a9:1c:2e:95:c6, 14:c9:cf:41:90:66, 22:28:3e:14:fc:d4, 44:a1:91:a5:79:c3, 44:a1:91:a5:79:c4, 24:21:5e:59:de:83, 68:77:da:0b:c0:78, 44:a1:91:a5:79:c2, ee:81:c7:d3:48:80, 24:b8:da:7c:3a:64, 6a:77:da:3b:c0:78, 44:a1:91:a5:79:c0, 68:77:da:0b:c0:79, 44:a1:91:a5:79:c1]","[GMBe3da, 艾力斯特, 芒果Mango, , LTE-WiFi_5A1D_5G, LTE-WiFi_5A1D, LTE-WiFi_5A1D, LTE-WiFi_5A1D_5G, tengye, wirelessDS, wirelessDS, livestream, Livat WiFi, camera, livestream, wirelesscs, Livat WiFi, camera, wirelesscs, tengye_5G, bawangchaji, MUJOSH, , , F888_9066, iTV-3Y2r, livestream, wirelesscs, RTL8186-default, 十二集新中式养生, camera, Xiaomi YU7_282555, CMCC-樊文花, , Livat WiFi, 十二集新中式养生-5G, wirelessDS]","[-57, -57, -65, -67, -69, -71, -72, -74, -76, -79, -79, -79, -79, -79, -79, -79, -80, -80, -80, -81, -81, -81, -81, -83, -84, -85, -85, -85, -86, -86, -86, -87, -87, -87, -89, -90, -90]"
signal_20251120_1711.csv,"['Lte', 'Lte']","[473, 475]","[-71, -86]","[24:69:68:f0:0d:88, bc:9b:5e:fc:58:bf, c0:49:43:b2:a9:e0, 7c:b5:9b:17:0a:70, bc:9b:5e:fc:58:c1, c0:49:43:f1:59:83, e8:9a:ff:06:a5:bb, c0:49:43:b2:a9:e1, 38:a9:1c:2e:95:c5, 44:a1:91:a5:79:d0, 44:a1:91:a5:79:d1, 44:a1:91:a5:79:d2, 44:a1:91:a5:79:d3, 5c:e8:83:7e:a4:b2, 44:a1:91:a5:79:c3, 5c:e8:83:7e:a4:b3, 5c:e8:83:7e:a4:b4, 68:77:da:0b:c0:78, 6a:77:da:3b:c0:78, 20:28:3e:04:fc:d4, 22:28:3e:14:fc:d4, 5c:e8:83:7e:a4:b1, 5c:e8:83:7e:a4:a0, 5c:e8:83:7e:a4:b0, 38:a9:1c:2e:95:c6, 3e:a9:1c:2e:95:c6, 44:a1:91:a5:79:c1, 5c:e8:83:7e:a4:a2, 5c:e8:83:7e:a4:a3, 24:21:5e:59:de:83]","[艾力斯特, 芒果Mango, LTE-WiFi_5A1D, , 芒果Mango, LTE-WiFi_5A1D_5G, DIRECT-13-Android_81d3, LTE-WiFi_5A1D_5G, tengye, Livat WiFi, wirelessDS, camera, livestream, camera, livestream, livestream, wirelesscs, 十二集新中式养生, , ChinaNet-3Y2r, iTV-3Y2r, wirelessDS, Livat WiFi, Livat WiFi, tengye_5G, , wirelessDS, camera, livestream, RTL8186-default]","[-61, -64, -67, -68, -70, -73, -73, -74, -79, -82, -82, -82, -82, -85, -85, -86, -86, -86, -86, -86, -87, -87, -87, -88, -88, -88, -88, -89, -89, -92]"
signal_20251120_1711.csv,"['Lte', 'Lte']","[473, 475]","[-68, -86]","[7c:b5:9b:17:0a:70, e8:9a:ff:06:a5:bb, bc:9b:5e:fc:58:c1, bc:9b:5e:fc:58:bf, 70:fd:45:71:14:4b, c0:49:43:f1:59:82, c0:49:43:f1:59:83, c0:49:43:b2:a9:e1, 68:77:da:0b:c0:78, 38:a9:1c:2e:95:c5, 44:a1:91:a5:79:d2, 44:a1:91:a5:79:d3, c0:49:43:b2:a9:e0, 44:a1:91:a5:79:d0, 44:a1:91:a5:79:d1, 44:a1:91:a5:79:d4, 5c:e8:83:7e:a4:b0, 5c:e8:83:7e:a4:b3, 38:a9:1c:2e:95:c6, 44:a1:91:a5:79:c0, 1a:3a:2f:c1:74:fd, 5c:e8:83:7e:a4:b1, 5c:e8:83:7e:a4:b2, 5c:e8:83:7e:a4:b4, 3e:a9:1c:2e:95:c6, 44:a1:91:a5:79:c2, 22:28:3e:14:fc:d4, 44:a1:91:a5:79:c1, 44:a1:91:a5:79:c4, 44:a1:91:a5:79:c3, 10:9f:4f:bc:f6:3a, d4:d2:d6:d4:ba:bd]","[, DIRECT-13-Android_81d3, 芒果Mango, 芒果Mango, hw_manage_1440, LTE-WiFi_5A1D, LTE-WiFi_5A1D_5G, LTE-WiFi_5A1D_5G, 十二集新中式养生, tengye, camera, livestream, LTE-WiFi_5A1D, Livat WiFi, wirelessDS, wirelesscs, Livat WiFi, livestream, tengye_5G, Livat WiFi, A5L-23-B17C3, wirelessDS, camera, wirelesscs, , camera, iTV-3Y2r, wirelessDS, wirelesscs, livestream, 修个机, CAR-DVR-babd]","[-64, -65, -71, -71, -72, -78, -79, -79, -79, -81, -82, -82, -83, -83, -83, -83, -87, -87, -87, -87, -87, -88, -88, -88, -88, -88, -89, -89, -90, -91, -92, -92]"
signal_20251120_1711.csv,"['Lte', 'Lte']","[473, 475]","[-69, -86]","[7c:b5:9b:17:0a:70, 24:69:68:f0:0d:88, e8:9a:ff:06:a5:bb, bc:9b:5e:fc:58:bf, 14:d8:64:ff:a9:df, bc:9b:5e:fc:58:c1, cc:29:bd:02:98:00, 70:fd:45:71:14:4b, c0:49:43:f1:59:83, c0:49:43:b2:a9:e1, c2:49:43:b2:a9:e1, 44:a1:91:a5:79:d0, 44:a1:91:a5:79:d1, 44:a1:91:a5:79:d2, 44:a1:91:a5:79:d3, 44:a1:91:a5:79:d4, c0:49:43:f1:59:82, c2:49:43:b1:59:83, 5c:e8:83:7e:a4:b0, 3e:a9:1c:2e:95:c6, 24:21:5e:59:de:83, 38:a9:1c:2e:95:c6, 44:a1:91:a5:79:c1, bc:13:a8:de:51:7f, 02:b5:53:61:39:60, 44:a1:91:a5:79:c2, 44:a1:91:a5:79:c3, 9e:d4:64:b3:95:39, 44:a1:91:a5:79:c4, a4:ba:70:d9:96:80]","[, 艾力斯特, DIRECT-13-Android_81d3, 芒果Mango, bawangchaji, 芒果Mango, Master boxing, hw_manage_1440, LTE-WiFi_5A1D_5G, LTE-WiFi_5A1D_5G, , Livat WiFi, wirelessDS, camera, livestream, wirelesscs, LTE-WiFi_5A1D, , Livat WiFi, , RTL8186-default, tengye_5G, wirelessDS, PPM, 萌宝奇贝, camera, livestream, Xiaomi YU7_838219, wirelesscs, qyst]","[-59, -63, -70, -71, -75, -76, -77, -79, -82, -82, -82, -82, -82, -82, -82, -82, -83, -85, -85, -86, -86, -88, -88, -88, -88, -90, -90, -90, -91, -91]"
signal_20251120_1711.csv,"['Lte', 'Lte']","[473, 475]","[-78, -86]","[bc:9b:5e:fc:58:bf, 7c:b5:9b:17:0a:70, e8:9a:ff:06:a5:bb, 24:69:68:f0:0d:88, bc:9b:5e:fc:58:c1, c0:49:43:f1:59:82, c0:49:43:b2:a9:e0, d4:d2:d6:d4:ba:bd, f0:b0:40:4c:2c:40, c0:49:43:b2:a9:e1, c2:49:43:b2:a9:e1, ac:5d:5c:88:9a:ec, c2:49:43:b1:59:83, c0:49:43:f1:59:83, ee:81:c7:d3:48:80, 14:d8:64:ff:a9:df, 44:a1:91:a5:79:d0, 5c:e8:83:7e:a4:b3, 44:a1:91:a5:79:d4, 1a:3a:2f:c1:74:fd, 68:4e:05:a5:00:a8, 44:a1:91:a5:79:d1, 44:a1:91:a5:79:d2, 44:a1:91:a5:79:d3, 5c:e8:83:7e:a4:b4, 5c:e8:83:7e:a4:b0, 5c:e8:83:7e:a4:b2, 44:a1:91:a5:79:c4, 22:28:3e:14:fc:d4, 5c:e8:83:7e:a4:b1, 44:a1:91:a5:79:c0, 70:fd:45:71:14:4b, 44:a1:91:a5:79:c1, 44:a1:91:a5:79:c3, 20:28:3e:04:fc:d4]","[芒果Mango, , DIRECT-13-Android_81d3, 艾力斯特, 芒果Mango, LTE-WiFi_5A1D, LTE-WiFi_5A1D, CAR-DVR-babd, 360行车记录仪M320Pro-3892, LTE-WiFi_5A1D_5G, , FAW_VW003ac5d5c889aec, , LTE-WiFi_5A1D_5G, Xiaomi YU7_282555, bawangchaji, Livat WiFi, livestream, wirelesscs, A5L-23-B17C3, 360行车记录仪G300Pro-282C, wirelessDS, camera, livestream, wirelesscs, Livat WiFi, camera, wirelesscs, iTV-3Y2r, wirelessDS, Livat WiFi, hw_manage_1440, wirelessDS, livestream, ChinaNet-3Y2r]","[-60, -68, -69, -73, -77, -78, -78, -79, -80, -81, -82, -83, -84, -85, -86, -86, -87, -87, -87, -87, -87, -88, -88, -88, -88, -89, -89, -89, -90, -90, -90, -90, -91, -91, -91]"
signal_20251120_1711.csv,"['Lte', 'Lte']","[473, 475]","[-76, -93]","[bc:9b:5e:fc:58:bf, 7c:b5:9b:17:0a:70, 24:69:68:f0:0d:88, bc:9b:5e:fc:58:c1, e8:9a:ff:06:a5:bb, c0:49:43:f1:59:82, 14:d8:64:ff:a9:df, 68:4e:05:a5:00:a8, f0:b0:40:4c:2c:40, c0:49:43:b2:a9:e0, ac:5d:5c:88:9a:ec, d4:d2:d6:d4:ba:bd, c0:49:43:b2:a9:e1, c2:49:43:b2:a9:e1, c0:49:43:f1:59:83, c2:49:43:b1:59:83, 44:a1:91:a5:79:d2, 44:a1:91:a5:79:d3, 5c:e8:83:7e:a4:b0, 44:a1:91:a5:79:d4, 20:28:3e:04:fc:d4, 44:a1:91:a5:79:d0, 44:a1:91:a5:79:d1, 24:b8:da:7c:3a:60, ee:81:c7:d3:48:80, 44:a1:91:a5:79:c1, 44:a1:91:a5:79:c0, 44:33:4c:9f:fa:d8, 10:9f:4f:bc:f6:3a]","[芒果Mango, , 艾力斯特, 芒果Mango, DIRECT-13-Android_81d3, LTE-WiFi_5A1D, bawangchaji, 360行车记录仪G300Pro-282C, 360行车记录仪M320Pro-3892, LTE-WiFi_5A1D, FAW_VW003ac5d5c889aec, CAR-DVR-babd, LTE-WiFi_5A1D_5G, , LTE-WiFi_5A1D_5G, , camera, livestream, Livat WiFi, wirelesscs, ChinaNet-3Y2r, Livat WiFi, wirelessDS, CMCC-樊文花, Xiaomi YU7_282555, wirelessDS, Livat WiFi, SUNLINK-C029-fad8, 修个机]","[-66, -73, -73, -74, -77, -79, -79, -79, -79, -80, -80, -82, -84, -85, -86, -88, -88, -88, -88, -88, -88, -89, -89, -89, -90, -90, -91, -91, -95]"
signal_20251120_1711.csv,"['Lte', 'Lte']","[473, 475]","[-79, -95]","[7c:b5:9b:17:0a:70, bc:9b:5e:fc:58:bf, 24:69:68:f0:0d:88, 1a:3a:2f:c1:74:fd, ac:5d:5c:88:9a:ec, c0:49:43:f1:59:82, e8:9a:ff:06:a5:bb, 68:4e:05:a5:00:a8, 44:df:65:9e:8d:57, bc:9b:5e:fc:58:c1, c0:49:43:b2:a9:e1, c2:49:43:b2:a9:e1, 9e:d4:64:b3:95:39, f0:b0:40:4c:2c:40, 9a:f9:cc:43:22:da, c2:49:43:b1:59:83, 44:a1:91:a5:79:d3, 44:a1:91:a5:79:d4, 20:28:3e:04:fc:d4, 28:f5:2b:76:88:9a, 44:a1:91:a5:79:d0, 44:a1:91:a5:79:d2, 5c:e8:83:7e:a4:b0, 24:b8:da:7c:3a:60, 62:00:d8:91:88:23, c0:49:43:f1:59:83, 44:a1:91:a5:79:d1, 24:21:5e:59:de:83, 2a:62:f1:e4:19:6d]","[, 芒果Mango, 艾力斯特, A5L-23-B17C3, FAW_VW003ac5d5c889aec, LTE-WiFi_5A1D, DIRECT-13-Android_81d3, 360行车记录仪G300Pro-282C, MUJOSH, 芒果Mango, LTE-WiFi_5A1D_5G, , Xiaomi YU7_838219, 360行车记录仪M320Pro-3892, IMmotorsCS, , livestream, wirelesscs, ChinaNet-3Y2r, DVR_889A, Livat WiFi, camera, Livat WiFi, CMCC-樊文花, Anruz888, LTE-WiFi_5A1D_5G, wirelessDS, RTL8186-default, yu7]","[-66, -73, -74, -77, -77, -78, -78, -79, -79, -80, -83, -83, -83, -85, -86, -87, -87, -87, -87, -87, -88, -88, -88, -88, -88, -89, -90, -91, -95]"
signal_20251120_1711.csv,"['Lte', 'Lte']","[473, 475]","[-83, -98]","[ac:5d:5c:88:9a:ec, 68:4e:05:a5:00:a8, 44:df:65:9e:8d:57, 7c:b5:9b:17:0a:70, d4:d2:d6:d4:ba:bd, 24:69:68:f0:0d:88, bc:9b:5e:fc:58:bf, 28:f5:2b:76:88:9a, c2:49:43:b2:a9:e1, c0:49:43:f1:59:82, c0:49:43:b2:a9:e1, 9e:d4:64:b3:95:39, 68:4a:ae:9f:64:a1, c0:49:43:f1:59:83, c2:49:43:b1:59:83, f0:b0:40:4c:2c:40, 44:a1:91:a5:79:d2, 44:a1:91:a5:79:d3, 44:a1:91:a5:79:d1, 24:37:c3:66:1e:a0, 44:a1:91:a5:79:d4, 38:a9:1c:2e:95:c5, 24:21:5e:59:de:83]","[FAW_VW003ac5d5c889aec, 360行车记录仪G300Pro-282C, MUJOSH, , CAR-DVR-babd, 艾力斯特, 芒果Mango, DVR_889A, , LTE-WiFi_5A1D, LTE-WiFi_5A1D_5G, Xiaomi YU7_838219, wirelessDS, LTE-WiFi_5A1D_5G, , 360行车记录仪M320Pro-3892, camera, livestream, wirelessDS, SZ034457, wirelesscs, tengye, RTL8186-default]","[-67, -69, -69, -72, -73, -75, -76, -80, -81, -83, -83, -84, -84, -85, -86, -86, -88, -88, -89, -89, -90, -90, -95]"
signal_20251120_1711.csv,"['Lte', 'Lte']","[473, 322]","[-81, -99]","[ac:5d:5c:88:9a:ec, 28:f5:2b:76:88:9a, d4:d2:d6:d4:ba:bd, 24:69:68:f0:0d:88, 1a:3a:2f:c1:74:fd, 68:4e:05:a5:00:a8, f0:b0:40:4c:2c:40, e8:9a:ff:06:a5:bb, aa:02:db:b7:55:b6, a8:02:db:97:55:b6, ee:81:c7:d3:48:80, c0:49:43:b2:a9:e1, c2:49:43:b1:59:83, 44:33:4c:9f:fa:d8, 9a:f9:cc:43:22:0b, c2:49:43:b2:a9:e1, c0:49:43:f1:59:83, 44:a1:91:a5:79:d0, 44:a1:91:a5:79:d2, 44:a1:91:a5:79:d3, 24:b8:da:7c:3a:60, 44:a1:91:a5:79:d1, 44:a1:91:a5:79:d4, 44:df:65:9e:8d:57, 24:37:c3:66:1e:a0, ce:29:bd:b0:8f:4f, 24:21:5e:59:de:83]","[FAW_VW003ac5d5c889aec, DVR_889A, CAR-DVR-babd, 艾力斯特, A5L-23-B17C3, 360行车记录仪G300Pro-282C, 360行车记录仪M320Pro-3892, DIRECT-13-Android_81d3, , HOPESHOW, Xiaomi YU7_282555, LTE-WiFi_5A1D_5G, , SUNLINK-C029-fad8, IMmotorsCS, , LTE-WiFi_5A1D_5G, Livat WiFi, camera, livestream, CMCC-樊文花, wirelessDS, wirelesscs, MUJOSH, SZ034457, , RTL8186-default]","[-69, -70, -73, -75, -77, -77, -79, -80, -80, -81, -84, -86, -86, -86, -86, -87, -88, -88, -88, -88, -88, -89, -90, -90, -90, -92, -93]"
signal_20251120_1711.csv,['Lte'],[473],[-78],"[ac:5d:5c:88:9a:ec, d4:d2:d6:d4:ba:bd, 7c:b5:9b:17:0a:70, 24:69:68:f0:0d:88, 68:4e:05:a5:00:a8, 28:f5:2b:76:88:9a, bc:9b:5e:fc:58:bf, ee:81:c7:d3:48:80, aa:02:db:b7:55:b6, f0:b0:40:4c:2c:40, a8:02:db:97:55:b6, 14:c9:cf:41:90:66, c0:49:43:f1:59:82, 9e:d4:64:b3:95:39, 44:df:65:9e:8d:57, 44:a1:91:a5:79:d2, 44:a1:91:a5:79:d4, 44:a1:91:a5:79:d0, 44:a1:91:a5:79:d1, 44:33:4c:9f:fa:d8, 44:a1:91:a5:79:c1, 44:a1:91:a5:79:c2, 34:75:63:5e:fa:84]","[FAW_VW003ac5d5c889aec, CAR-DVR-babd, , 艾力斯特, 360行车记录仪G300Pro-282C, DVR_889A, 芒果Mango, Xiaomi YU7_282555, , 360行车记录仪M320Pro-3892, HOPESHOW, F888_9066, LTE-WiFi_5A1D, Xiaomi YU7_838219, MUJOSH, camera, wirelesscs, Livat WiFi, wirelessDS, SUNLINK-C029-fad8, wirelessDS, camera, DVR-fa84]","[-67, -73, -74, -77, -77, -77, -80, -80, -80, -82, -82, -84, -86, -88, -88, -89, -89, -90, -90, -90, -92, -93, -93]"
signal_20251120_1711.csv,['Lte'],[473],[-79],"[ac:5d:5c:88:9a:ec, 68:4e:05:a5:00:a8, 1a:3a:2f:c1:74:fd, d4:d2:d6:d4:ba:bd, 24:69:68:f0:0d:88, 7c:b5:9b:17:0a:70, 28:f5:2b:76:88:9a, e8:9a:ff:06:a5:bb, 14:c9:cf:41:90:66, f0:b0:40:4c:2c:40, ee:81:c7:d3:48:80, c0:49:43:f1:59:82, bc:9b:5e:fc:58:bf, 44:a1:91:a5:79:d3, 44:a1:91:a5:79:d1, 44:a1:91:a5:79:d2, 44:a1:91:a5:79:d0, 44:a1:91:a5:79:d4, 9a:f9:cc:43:22:da, c0:49:43:f1:59:83, 44:df:65:9e:8d:57, 62:00:d8:91:88:23, 9a:f9:cc:43:22:0b, 22:28:3e:14:fc:d4]","[FAW_VW003ac5d5c889aec, 360行车记录仪G300Pro-282C, A5L-23-B17C3, CAR-DVR-babd, 艾力斯特, , DVR_889A, DIRECT-13-Android_81d3, F888_9066, 360行车记录仪M320Pro-3892, Xiaomi YU7_282555, LTE-WiFi_5A1D, 芒果Mango, livestream, wirelessDS, camera, Livat WiFi, wirelesscs, IMmotorsCS, LTE-WiFi_5A1D_5G, MUJOSH, Anruz888, IMmotorsCS, iTV-3Y2r]","[-60, -73, -75, -76, -77, -79, -79, -81, -81, -82, -83, -84, -86, -87, -88, -88, -89, -89, -89, -90, -91, -91, -91, -94]"
signal_20251120_1711.csv,"['Lte', 'Lte']","[473, 474]","[-76, -97]","[ee:81:c7:d3:48:80, 14:c9:cf:41:90:66, 7c:b5:9b:17:0a:70, d4:d2:d6:d4:ba:bd, ac:5d:5c:88:9a:ec, 28:f5:2b:76:88:9a, f0:b0:40:4c:2c:40, 14:51:7e:5e:26:f9, 24:69:68:f0:0d:88, 68:4e:05:a5:00:a8, 14:51:7e:5e:26:f7, 9e:d4:64:b3:95:39, d2:c6:b7:70:dc:d8, ee:7e:38:d3:48:80, e8:9a:ff:06:a5:bb, 44:33:4c:9f:fa:d8, 9a:f9:cc:43:22:0b, 14:51:7e:5e:2d:4d, 9a:f9:cc:43:22:aa, c0:49:43:f1:59:82]","[Xiaomi YU7_282555, F888_9066, , CAR-DVR-babd, FAW_VW003ac5d5c889aec, DVR_889A, 360行车记录仪M320Pro-3892, , 艾力斯特, 360行车记录仪G300Pro-282C, NIO-Space-2.4G, Xiaomi YU7_838219, DIRECT-Xiaomi_YU7_473896, Xiaomi YU7_282555, DIRECT-13-Android_81d3, SUNLINK-C029-fad8, IMmotorsCS, , IMmotorsCS, LTE-WiFi_5A1D]","[-75, -75, -79, -79, -79, -79, -80, -80, -81, -81, -81, -83, -83, -83, -86, -86, -90, -91, -91, -92]"
signal_20251120_1711.csv,['Lte'],[473],[-73],"[68:4e:05:a5:00:a8, 14:c9:cf:41:90:66, d4:d2:d6:d4:ba:bd, f0:b0:40:4c:2c:40, 24:69:68:f0:0d:88, ee:81:c7:d3:48:80, 9e:d4:64:b3:95:39, ac:5d:5c:88:9a:ec, 28:f5:2b:76:88:9a, 7c:b5:9b:17:0a:70, e8:9a:ff:06:a5:bb, 14:51:7e:5e:26:f7, 14:51:7e:5e:2d:4b, d2:c6:b7:70:dc:d8, 14:51:7e:5e:2d:4d, ee:7e:38:d3:48:80]","[360行车记录仪G300Pro-282C, F888_9066, CAR-DVR-babd, 360行车记录仪M320Pro-3892, 艾力斯特, Xiaomi YU7_282555, Xiaomi YU7_838219, FAW_VW003ac5d5c889aec, DVR_889A, , DIRECT-13-Android_81d3, NIO-Space-2.4G, NIO-Space-2.4G, DIRECT-Xiaomi_YU7_473896, , Xiaomi YU7_282555]","[-77, -77, -78, -78, -79, -79, -80, -80, -80, -82, -82, -82, -82, -86, -86, -87]"
signal_20251120_1711.csv,"['Lte', 'Lte', 'Lte']","[473, 474, 322]","[-78, -97, -97]","[d4:d2:d6:d4:ba:bd, ac:5d:5c:88:9a:ec, 9e:d4:64:b3:95:39, 14:51:7e:5e:26:f7, 14:c9:cf:41:90:66, 68:4e:05:a5:00:a8, ee:81:c7:d3:48:80, d2:c6:b7:70:dc:d8, ee:7e:38:d3:48:80, 1e:e1:92:de:99:55, e8:9a:ff:06:a5:bb, 44:33:4c:9f:fa:d8, 28:f5:2b:76:88:9a, 14:51:7e:5e:26:f9, 14:51:7e:5e:2d:4b, f0:b0:40:4c:2c:40, 24:69:68:f0:0d:88, 70:fd:45:4b:1c:13, 70:fd:45:4b:1c:14, 72:77:2a:61:48:b9, 1e:e1:92:de:99:d4, 9a:f9:cc:43:22:da, 14:51:7e:5e:2d:4d, 9e:2b:9b:b3:95:39, 70:fd:45:4b:1c:11, 70:fd:45:4b:1c:12, f4:2a:7d:19:1a:e7, a2:cf:f5:17:76:99, 4c:c6:4c:84:1b:05]","[CAR-DVR-babd, FAW_VW003ac5d5c889aec, Xiaomi YU7_838219, NIO-Space-2.4G, F888_9066, 360行车记录仪G300Pro-282C, Xiaomi YU7_282555, DIRECT-Xiaomi_YU7_473896, Xiaomi YU7_282555, DIRECT-BMW 54068, DIRECT-13-Android_81d3, SUNLINK-C029-fad8, DVR_889A, , NIO-Space-2.4G, 360行车记录仪M320Pro-3892, 艾力斯特, livestream, wirelesscs, DIRECT-Xiaomi_YU7_410299, DIRECT-BMW 54068, IMmotorsCS, , Xiaomi YU7_838219, wirelessDS, camera, POPMART, iTV-wmGq, dreame]","[-67, -74, -75, -75, -76, -79, -81, -81, -81, -81, -82, -82, -83, -83, -83, -84, -86, -87, -87, -87, -87, -88, -88, -88, -89, -89, -92, -93, -94]"
signal_20251120_1711.csv,"['Lte', 'Lte']","[473, 474]","[-77, -96]","[d4:d2:d6:d4:ba:bd, ee:81:c7:d3:48:80, 14:c9:cf:41:90:66, 14:51:7e:5e:26:f9, 14:51:7e:5e:26:f7, 9e:d4:64:b3:95:39, d2:c6:b7:70:dc:d8, ee:7e:38:d3:48:80, 9e:89:80:ce:56:09, ac:5d:5c:88:9a:ec, f0:b0:40:4c:2c:40, 1e:e1:92:de:99:55, 78:a1:3e:fa:28:e9, 7c:b5:9b:17:0a:70, 68:4e:05:a5:00:a8, 28:f5:2b:76:88:9a, 14:51:7e:5e:2d:4d, 72:77:2a:61:48:b9, 9e:2b:9b:b3:95:39, 1e:e1:92:de:99:d4, 1a:3a:2f:c1:74:fd, 14:51:7e:5e:2d:4b, 70:fd:45:4b:1c:12, 70:fd:45:4b:1c:14, 70:fd:45:4b:1c:10, 70:fd:45:4b:1c:11, 70:fd:45:4b:1c:13, 24:69:68:f0:0d:88, 9a:f9:cc:43:22:da, 66:e2:20:e3:5e:b8, 2a:62:f1:e4:19:6d]","[CAR-DVR-babd, Xiaomi YU7_282555, F888_9066, , NIO-Space-2.4G, Xiaomi YU7_838219, DIRECT-Xiaomi_YU7_473896, Xiaomi YU7_282555, , FAW_VW003ac5d5c889aec, 360行车记录仪M320Pro-3892, DIRECT-BMW 54068, XP-Printer, , 360行车记录仪G300Pro-282C, DVR_889A, , DIRECT-Xiaomi_YU7_410299, Xiaomi YU7_838219, DIRECT-BMW 54068, A5L-23-B17C3, NIO-Space-2.4G, camera, wirelesscs, Livat WiFi, wirelessDS, livestream, 艾力斯特, IMmotorsCS, MBUX 32235, yu7]","[-64, -68, -70, -72, -73, -74, -77, -77, -77, -81, -81, -82, -83, -84, -84, -85, -85, -85, -86, -86, -87, -87, -87, -87, -87, -88, -88, -89, -89, -89, -92]"
signal_20251120_1711.csv,['Lte'],[473],[-80],"[d4:d2:d6:d4:ba:bd, 9e:d4:64:b3:95:39, f0:b0:40:4c:2c:40, ac:5d:5c:88:9a:ec, ee:81:c7:d3:48:80, 14:c9:cf:41:90:66, 9e:2b:9b:b3:95:39, 72:77:2a:61:48:b9, 24:69:68:f0:0d:88, 28:f5:2b:76:88:9a, ee:7e:38:d3:48:80, 1e:e1:92:de:99:d4, 7c:b5:9b:17:0a:70, 7c:39:85:6e:eb:f1, 7c:39:85:6e:eb:f3, 14:51:7e:5e:26:f9, 70:fd:45:4b:1c:10, 70:fd:45:4b:1c:12, 70:fd:45:4b:1c:11, 70:fd:45:4b:1c:14, 2a:62:f1:e4:19:6d, 14:51:7e:5e:2d:4d, 2a:c8:7c:11:d3:93, 22:14:0b:44:07:d2]","[CAR-DVR-babd, Xiaomi YU7_838219, 360行车记录仪M320Pro-3892, FAW_VW003ac5d5c889aec, Xiaomi YU7_282555, F888_9066, Xiaomi YU7_838219, DIRECT-Xiaomi_YU7_410299, 艾力斯特, DVR_889A, Xiaomi YU7_282555, DIRECT-BMW 54068, , HUAWEI EA, Cashier, , Livat WiFi, camera, wirelessDS, wirelesscs, yu7, , iTV-5SWf, ]","[-57, -68, -74, -76, -77, -79, -79, -80, -82, -83, -86, -86, -87, -87, -88, -89, -89, -90, -91, -91, -91, -93, -93, -94]"
signal_20251120_1711.csv,"['Lte', 'Lte']","[473, 474]","[-83, -92]","[d4:d2:d6:d4:ba:bd, 9e:89:80:ce:56:09, 9e:d4:64:b3:95:39, ee:81:c7:d3:48:80, 72:77:2a:61:48:b9, 9e:2b:9b:b3:95:39, f0:b0:40:4c:2c:40, ac:5d:5c:88:9a:ec, d2:c6:b7:70:dc:d8, 7c:b5:9b:17:0a:70, ee:7e:38:d3:48:80, 28:f5:2b:76:88:9a, 14:51:7e:5e:26:f7, 68:4e:05:a5:00:a8, 14:c9:cf:41:90:66, 24:69:68:f0:0d:88, 78:a1:3e:fa:28:e9, 78:a1:3e:fa:28:e8]","[CAR-DVR-babd, , Xiaomi YU7_838219, Xiaomi YU7_282555, DIRECT-Xiaomi_YU7_410299, Xiaomi YU7_838219, 360行车记录仪M320Pro-3892, FAW_VW003ac5d5c889aec, DIRECT-Xiaomi_YU7_473896, , Xiaomi YU7_282555, DVR_889A, NIO-Space-2.4G, 360行车记录仪G300Pro-282C, F888_9066, 艾力斯特, XP-Printer, XP-OFFICE]","[-62, -63, -73, -74, -74, -74, -75, -77, -80, -81, -81, -82, -82, -83, -84, -88, -89, -89]"
signal_20251120_1711.csv,"['Lte', 'Lte']","[473, 474]","[-85, -94]","[d4:d2:d6:d4:ba:bd, ee:81:c7:d3:48:80, 9e:d4:64:b3:95:39, 72:77:2a:61:48:b9, 9e:2b:9b:b3:95:39, f0:b0:40:4c:2c:40, 44:33:4c:9f:fa:d8, d2:c6:b7:70:dc:d8, 14:c9:cf:41:90:66, ee:7e:38:d3:48:80, e8:9a:ff:06:a5:bb, 7c:b5:9b:17:0a:70, ac:5d:5c:88:9a:ec, 28:f5:2b:76:88:9a, 34:75:63:5e:fa:84, 70:fd:45:4b:1c:10, 70:fd:45:4b:1c:12, 70:fd:45:4b:1c:13, 70:fd:45:4b:1c:14, 70:fd:45:4b:1c:11, 78:a1:3e:fa:28:e9]","[CAR-DVR-babd, Xiaomi YU7_282555, Xiaomi YU7_838219, DIRECT-Xiaomi_YU7_410299, Xiaomi YU7_838219, 360行车记录仪M320Pro-3892, SUNLINK-C029-fad8, DIRECT-Xiaomi_YU7_473896, F888_9066, Xiaomi YU7_282555, DIRECT-13-Android_81d3, , FAW_VW003ac5d5c889aec, DVR_889A, DVR-fa84, Livat WiFi, camera, livestream, wirelesscs, wirelessDS, XP-Printer]","[-57, -69, -71, -79, -79, -80, -80, -80, -81, -81, -82, -83, -83, -85, -85, -87, -88, -88, -88, -89, -94]"
signal_20251120_1711.csv,"['Lte', 'Lte']","[473, 474]","[-77, -95]","[9e:d4:64:b3:95:39, 9e:89:80:ce:56:09, d4:d2:d6:d4:ba:bd, ee:81:c7:d3:48:80, 72:77:2a:61:48:b9, 9e:2b:9b:b3:95:39, f0:b0:40:4c:2c:40, 34:75:63:5e:fa:84, 7c:b5:9b:17:0a:70, 14:c9:cf:41:90:66, e8:9a:ff:06:a5:bb, ac:5d:5c:88:9a:ec, 70:fd:45:4b:1c:10, 28:f5:2b:76:88:9a, 70:fd:45:4b:1c:12, 70:fd:45:4b:1c:14, 70:fd:45:4b:1c:11, 70:fd:45:4b:1c:13, 70:fd:45:4b:1c:01, 2a:62:f1:e4:19:6d]","[Xiaomi YU7_838219, , CAR-DVR-babd, Xiaomi YU7_282555, DIRECT-Xiaomi_YU7_410299, Xiaomi YU7_838219, 360行车记录仪M320Pro-3892, DVR-fa84, , F888_9066, DIRECT-13-Android_81d3, FAW_VW003ac5d5c889aec, Livat WiFi, DVR_889A, camera, wirelesscs, wirelessDS, livestream, wirelessDS, yu7]","[-55, -57, -61, -68, -72, -73, -79, -83, -85, -86, -87, -87, -87, -88, -88, -88, -89, -90, -90, -93]"
signal_20251120_1711.csv,"['Lte', 'Lte']","[473, 474]","[-84, -95]","[9e:d4:64:b3:95:39, 9e:89:80:ce:56:09, d4:d2:d6:d4:ba:bd, 72:77:2a:61:48:b9, 9e:2b:9b:b3:95:39, ee:81:c7:d3:48:80, d2:c6:b7:70:dc:d8, ee:7e:38:d3:48:80, 70:fd:45:4b:1c:10, 70:fd:45:4b:1c:11, 70:fd:45:4b:1c:12, 70:fd:45:4b:1c:13, 70:fd:45:4b:1c:14, 34:75:63:5e:fa:84, 28:f5:2b:76:88:9a, 14:51:7e:5e:2d:4d, 7c:b5:9b:17:0a:70, 14:51:7e:5e:2d:4b, 14:51:7e:5e:26:f9, 9a:f9:cc:43:22:0b]","[Xiaomi YU7_838219, , CAR-DVR-babd, DIRECT-Xiaomi_YU7_410299, Xiaomi YU7_838219, Xiaomi YU7_282555, DIRECT-Xiaomi_YU7_473896, Xiaomi YU7_282555, Livat WiFi, wirelessDS, camera, livestream, wirelesscs, DVR-fa84, DVR_889A, , , NIO-Space-2.4G, , IMmotorsCS]","[-58, -59, -69, -72, -74, -76, -80, -80, -80, -82, -82, -82, -82, -86, -88, -90, -91, -91, -92, -92]"
signal_20251120_1711.csv,"['Lte', 'Lte']","[473, 474]","[-83, -85]","[9e:d4:64:b3:95:39, 9e:89:80:ce:56:09, d4:d2:d6:d4:ba:bd, 72:77:2a:61:48:b9, 9e:2b:9b:b3:95:39, ee:81:c7:d3:48:80, d2:c6:b7:70:dc:d8, ee:7e:38:d3:48:80, 70:fd:45:4b:1c:10, 70:fd:45:4b:1c:11, 70:fd:45:4b:1c:12, 70:fd:45:4b:1c:13, 70:fd:45:4b:1c:14, 34:75:63:5e:fa:84, 28:f5:2b:76:88:9a, 14:51:7e:5e:2d:4d, 7c:b5:9b:17:0a:70, 14:51:7e:5e:2d:4b, 14:51:7e:5e:26:f9, 9a:f9:cc:43:22:0b]","[Xiaomi YU7_838219, , CAR-DVR-babd, DIRECT-Xiaomi_YU7_410299, Xiaomi YU7_838219, Xiaomi YU7_282555, DIRECT-Xiaomi_YU7_473896, Xiaomi YU7_282555, Livat WiFi, wirelessDS, camera, livestream, wirelesscs, DVR-fa84, DVR_889A, , , NIO-Space-2.4G, , IMmotorsCS]","[-58, -59, -69, -72, -74, -76, -80, -80, -81, -82, -82, -82, -82, -86, -88, -90, -91, -91, -92, -92]"
signal_20251120_1711.csv,"['Lte', 'Lte']","[473, 474]","[-92, -93]","[9e:d4:64:b3:95:39, 5e:19:20:a8:5f:1f, 9e:89:80:ce:56:09, ee:81:c7:d3:48:80, d4:d2:d6:d4:ba:bd, d2:c6:b7:70:dc:d8, ee:7e:38:d3:48:80, 72:77:2a:61:48:b9, 9e:2b:9b:b3:95:39, 14:c9:cf:41:90:66, 70:fd:45:4b:1c:13, 70:fd:45:4b:1c:11, 70:fd:45:4b:1c:12, 70:fd:45:4b:1c:14, 70:fd:45:4b:1c:10, 70:fd:45:4b:1c:03, 14:51:7e:5e:26:f9, 1e:e1:92:de:99:d4, 1e:e1:92:de:99:55, 14:51:7e:5e:2d:4d, 14:51:7e:5e:2d:4b, 14:51:7e:5e:26:f7]","[Xiaomi YU7_838219, , , Xiaomi YU7_282555, CAR-DVR-babd, DIRECT-Xiaomi_YU7_473896, Xiaomi YU7_282555, DIRECT-Xiaomi_YU7_410299, Xiaomi YU7_838219, F888_9066, livestream, wirelessDS, camera, wirelesscs, Livat WiFi, livestream, , DIRECT-BMW 54068, DIRECT-BMW 54068, , NIO-Space-2.4G, NIO-Space-2.4G]","[-57, -59, -64, -65, -73, -75, -75, -77, -77, -79, -83, -84, -84, -84, -84, -85, -86, -86, -87, -88, -90, -91]"
